Timestamp,Census Tract,"On a scale of 1 - 5, where 1 is ""None"" and 5 is ""A Lot"", how many empty beer or liquor bottles are visible in streets, yards, or alleys? ","On a scale of 1 - 5, where 1 is ""None"" and 5 is ""A Lot"",  how many cigarette or cigar butts or discarded cigarette packages  are on the sidewalk or in the gutters? ","On a scale of 1 - 5, where 1 is ""None"" and 5 is ""A Lot"",  how many condoms are present on the sidewalk, in the gutters, or street of block face? ","On a scale of 1 - 5, where 1 is ""None"" and 5 is ""A Lot"", how much garbage, litter, or broken glass in the street or on the sidewalks? ", Are there abandoned cars in the neighborhood? How many do you see? ,"On a scale of 1-5 where 1 is ""Friendly Responses / Greetings / Helpful"" and 5 is ""Treated with Suspicion"", How were you regarded by the people in the block face?","On a scale of 1 - 4, where 1 is ""Very well kept / good condition"" and 4 is ""Poor / badly deteriorated condition"", in general, how would you rate the condition of buildings on the block face? (includes residential buildings, recreational facilities, manufacturing plants, business / industrial headquarters, etc)","Is there graffiti or evidence of graffiti that has been painted over on buildings, signs, or walls? (Questions 22-23)","On a scale of 1 - 4, where 1 is ""No fencing"" and 4 is ""High mesh fencing with barbed wire or spiked tops"", is there fencing and what kind? (includes all property)",Are any commercial/residential buildings being renovated?,What kinds of establishments are there on the block face? Select all that apply.,"On a scale of 1-3, where 1 is ""Few or none"" and 3 is a ""Most/all of it"", how many trees are linking the street of the block face? ",Is there public transportation available in the block face? ,Are private security guards visible?,Is there a police officer visible? ,Image #1,"Full Address of Block Face in Image #1 (Street Number, Street Name, City, State, Zip Code). E.g.: 2128 Oxford Street, Berkeley, CA, 94704.",Other thoughts or comments for Image #1,Image #2,"Full Address of Block Face in Image #2 (Street Number, Street Name, City, State, Zip Code). E.g.: 2128 Oxford Street, Berkeley, CA, 94704.",Other thoughts or comments for Image #2,Image #3,"Full Address of Block Face in Image #3 (Street Number, Street Name, City, State, Zip Code). E.g.: 2128 Oxford Street, Berkeley, CA, 94704.",Other thoughts or comments for Image #3,Image #4,Other thoughts or comments for Image #4,"Full Address of Block Face in Image #4 (Street Number, Street Name, City, State, Zip Code). E.g.: 2128 Oxford Street, Berkeley, CA, 94704.",Image #5,"Full Address of Block Face in Image #5 (Street Number, Street Name, City, State, Zip Code). E.g.: 2128 Oxford Street, Berkeley, CA, 94704.",Other thoughts or comments for Image #5,Image #1 coordinates,Image #2 coordinates,Image #3 coordinates,Image #4 coordinates,Image #5 coordinates
10/21/2018 22:08:57,4028.0,1.0,3.0,1.0,3.0,0.0,2.0,2.0,Yes,2.0,No,"Eating places/restaurants, Professional offices (doctor dentist lawyer accountant real estate)",2.0,No,No,No,https://drive.google.com/open?id=1F2vSKuf4hRQz4j6AJqv4s5zm1O4FvM13,"1633 San Pablo Ave, Oakland, CA",I found it interesting because the man was very detailed and looked extremely realistic so it caught my attention. I feel that it emphasizes the importance of firefighters in the city of Oakland. ,https://drive.google.com/open?id=1Zd2LzopzPuDkTa5DaQ2PSVcaLt-ZoDIB,"Touraine Hotel 1502-1583 Clay Street Oakland, CA","This building was intriguing because the architecture of this building seems old, so it stood out from the rest of the buildings on this block. At first glance, you notice that the sign says that it is a hotel, though when you take a look at the windows, it seems like it has become occupied by permanent residents. ",https://drive.google.com/open?id=1u9fX5SCo4VrxB0A3J-dH0ueIYPWcd9Bx,Cape & Cowl Restaurant.  1602 Clay Street Oakland CA,"This picture caught my attention because of the political signs, “Oakland Stands United Against Hate” and “March for Our Lives”
For me personally, signs like these touch my heart because I feel that it is important to stand together in the Bay Area against racism and discrimination, as it has become more evident with the recent political climate. I was born and raised in the Bay Area and it makes me proud when people stand for what is right.  ",,,,,,,"[37.8229594, -122.2773453]","(37.8087183, -122.2715003)","(37.8087183, -122.2715003)",,
10/21/2018 22:10:14,4229.0,2.0,2.0,1.0,2.0,0.0,4.0,2.0,Yes,2.0,Yes,"Eating places/restaurants, Professional offices (doctor dentist lawyer accountant real estate)",2.0,Yes,No,No,https://drive.google.com/open?id=1t7Cm2UkrM467FxsdfYNLc980RShLq1J2,"2150 Channing Way, Berkeley, CA, 94704",I found this graffiti on a wall in the parking lot of a residential building.,https://drive.google.com/open?id=1-Kz4-Fbk5G7w39A1Vwu6nMLzvYKMJFGM,"Channing Way and Shattuck Ave, Berkeley, CA, 94704",There is a Ford Bike Station and it is almost full.,https://drive.google.com/open?id=1zjA9f2t64BX0MA9Taz4foCWXRD9LvG2C,"2344 Fulton St, Berkeley, CA, 94704",This is a house for Cal's track and field team.,https://drive.google.com/open?id=1ZGfWt-nuNBqy_m9wLT_QvnDlrJEviI5W,"Someone put a sticker saying ""eating animals"" on the stop sign, so it seems like ""STOP EATING ANIMALS.""","Channing Way and Fulton St, Berkeley, CA, 94704",https://drive.google.com/open?id=1f2JyD7z6fSZCO6vqtIlaWvdVyn-i5ZsW,"2121 Channing Way, Berkeley, CA, 94704",There is a Buddhist Temple which shows the diversity of the neighborhood. ,"[37.8658887573699, -122.266275305354]","(37.8678899, -122.269247)","[37.8666288180719, -122.265876910725]","(37.8678899, -122.269247)","[37.866019739311, -122.266542125136]"
10/21/2018 22:23:08,4006.0,1.0,1.0,1.0,2.0,0.0,4.0,2.0,Yes,2.0,No,Liquor stores or Marijuana Dispensaries,2.0,Yes,No,Yes,https://drive.google.com/open?id=1K2U0ccdwjWB5MMC9bbNyA0bJlCxCE7UB,5634 Shattuck Ave. ,"This art shop looked out of place next to the neighborhood, especially right across from the liquor store. 
",https://drive.google.com/open?id=1ON0rVTsybNXEBRBYR5JPrYhdot7_MYP4,5699 Shattuck Ave. ,"This was the only apparent property that was for sale on the block. It was boarded up on one side with bits of graffiti scribbled over the walls. A door had graffiti on it but was painted over. 
",https://drive.google.com/open?id=13vvO_O3GiEu0rzlrpIhbiMHz_bRZsb-9,608 Shattuck Ave. ,"The side of the block near Shattuck was more dilapidated than the rest of the block and were more likely to have bars on windows.
",,,,,,,"[37.8724895, -122.2684359]","[37.8724895, -122.2684359]","[35.130098959596, -119.460902121212]",,
10/22/2018 0:01:58,4224.0,3.0,2.0,1.0,3.0,1.0,3.0,2.0,No,3.0,Yes,"Bars and alcoholic beverage services, Eating places/restaurants, Fast food or take-out places, Liquor stores or Marijuana Dispensaries, Warehouses",2.0,Yes,No,No,https://drive.google.com/open?id=1bC5tf0RrhU8ucWutTbwSA8Cbs91ePyhx,"2067 University Ave, Berkeley, CA, 94704.","It seems that the wall was not designed for locals to post signs, but it had become such a place since many signs were attached there.",https://drive.google.com/open?id=1lq2-AA8zbS9USxwmhTY_sdSbcBM5wPhu,"2067-2071 University Ave, Berkeley, CA, 94704.",There were groups of homeless people outside the restaurants whose belongings almost occupied  the street.,https://drive.google.com/open?id=1XZ7O9Iv-vJlp0KGiAO9DNACW2kGHMSwe,"2011 Berkeley Way, Berkeley, CA, 94704.","There are No-parking signs on the fence, but several cars were still parked there. Besides, there were many parking spaces in the parking lot nearby.",https://drive.google.com/open?id=1xAhyRXCveyHCQLoWGKEjyEzODs2v7vjx,There is a large graffiti on the wall of the parking lot which was quite conspicuous when we passed by.,"2016 Berkeley Way, Berkeley, CA, 94704.",https://drive.google.com/open?id=1IRztM7ZX4HzLNUhHrLboa2Uy1m-Xr8uo,"2005 Berkeley Way, Berkeley, CA, 94704.",The fence and iron gate shows that crimes may happen sometimes?,"[37.8720195886659, -122.269816641442]","[37.8720195886659, -122.269816641442]","[37.8728409227947, -122.270248811613]","[37.8726479989409, -122.2704598844]","[37.8728723, -122.2704417]"
10/22/2018 0:08:49,4031.0,1.0,3.0,1.0,3.0,0.0,2.0,2.0,Yes,1.0,No,"Bodega deli corner-store convenience store, Eating places/restaurants, Payday lenders check cashers or pawn shops, Supermarkets/grocery stores",1.0,No,No,No,https://drive.google.com/open?id=1DAEeW4g8askpmgbaR8JXlkYzaij7yJQK,"535 8th St, Oakland, CA, 94607","There were a few of these green dumpsters throughout the block. All of them had different ""tagging"" on them. I also thought it was interesting that there was a lot of trash on the curbs of the street, but none of the dumpsters seemed full.",https://drive.google.com/open?id=1HNYxCgjW-eQQqQFPjCzhG1YltpIexWgK,"517 8th St, Oakland, CA, 94607","There were some ""pay and display"" parking ticket machines like this on the block. The street parking was also filled up during the time I was there, so it seems that this area experiences a good number of visitors. However, I did see some people park their cars here and then walk away to a different block that seemed to have more bars and fancier-looking storefronts. ",https://drive.google.com/open?id=1kyhPjq_yANAlj951QKecJ-pAWMKWi3Go,"530 8th St, Oakland, CA, 94607","This was one of four buildings that seemed abandoned/empty to me on this block (the one next to this had cardboard covering the windows from the inside). Both had some light ""tagging"" on the windows. This building in particular has a ""for lease"" sign on it. ",https://drive.google.com/open?id=147w7g4FMLP4X8cjC-QxD-xVE8Yk_I9Wb,"I took a picture of this truck because it seemed like someone was using it as storage space for their things. It seems like an old truck, but I'm not sure if I would classify it as ""abandoned"". There was also a lot of cigarette butts on the ground.  ","810 Clay St, Oakland, CA 94607",https://drive.google.com/open?id=177FjcfjP9mOJx7GkLWvsjwh9AKG7GfjX,"512 8th St, Oakland, CA 94607","I was really surprised to find a temple on this block because it wasn't something I was expecting to find in this area. It seems to be a Buddhist temple because I also saw a small shrine to place incense sticks on the sidewalk, across the front doors. There were a few posters with Chinese descriptions on the door as well. Some of the buildings on this street also had signs written in Chinese.   ","[37.7964115, -122.2643766]","[37.7964115, -122.2643766]","[37.8009167156494, -122.275402395618]","[37.801272625156, -122.276025874901]","[37.8008494265101, -122.275235462283]"
10/22/2018 0:09:49,4239.01,1.0,1.0,1.0,3.0,0.0,2.0,2.0,No,1.0,Yes,"Bars and alcoholic beverage services, Professional offices (doctor dentist lawyer accountant real estate)",2.0,Yes,Yes,No,https://drive.google.com/open?id=1J7FBN9UWvZIhi2aFFG18yyqbJgDqFozu,"3033 Shattuck Ave, Berkeley, CA 94705",View from the corner of Essex and Shattuck,https://drive.google.com/open?id=1CSHGT6G4TayqlTNRyS4JhmTgJrTEMWrf,"3045 Shattuck Ave, Berkeley, CA 94705",View facing Shattuck Ave,https://drive.google.com/open?id=12aeAsa3F1uLPsasS1ppCikxJ5ax_s85V,"3051 Shattuck Ave, Berkeley, CA 94705",Down Shattuck Ave,https://drive.google.com/open?id=1UxrYJd9YcdFyLSvxUa_FhYGOwPBvsj3k,Residential house of Shattuck Ave,"3028 Shattuck Ave, Berkeley, CA 94705",https://drive.google.com/open?id=1fpi2WbAMu9LVXLBEzs0sIlDrvWl8YNCZ,"3040 Shattuck Ave, Berkeley, CA 92405",Shattuck Ave residences,"[37.8540256666667, -122.266213]","[37.8536801, -122.266042711164]","[37.8536181290323, -122.266159419355]","[37.8541573333333, -122.266228]","[37.8537052419355, -122.26617166129]"
10/22/2018 10:52:35,4027.0,4.0,4.0,2.0,4.0,1.0,4.0,4.0,Yes,4.0,No,"Bars and alcoholic beverage services, Bodega deli corner-store convenience store, Liquor stores or Marijuana Dispensaries, Manufacturing, Warehouses",2.0,Yes,No,No,https://drive.google.com/open?id=1E4SxFgUUjtaRxjKp01bKNctUwvI2GfOf,"2174 Brush St  Oakland, California  94612",Run down warehouse with razor wire fencing ,https://drive.google.com/open?id=1VrNGa3B4pUpf8YzwbY1khaTLUdb7qkPs,"2174 Brush St  Oakland, California  94612","Run down shed, that was tagged ",https://drive.google.com/open?id=1bs0bU6-uBOcO4dlRqlYxgFm5z8vH5Qju,"2174 Brush St  Oakland, California  94612",Tagged Utility monitor ,https://drive.google.com/open?id=1apZxUe144jLiZ0q-W68E9idAsfPw4pE5,Trash on Street ,"2174 Brush St  Oakland, California  94612",https://drive.google.com/open?id=1qs7c1Oc4cf6Vf7bb6Vg1ykohgX8IKku5,"2174 Brush St  Oakland, California  94612",Political mural painting ,"[37.8121013877551, -122.275144755102]","[37.8121013877551, -122.275144755102]","[37.8121013877551, -122.275144755102]","[37.8121013877551, -122.275144755102]","[37.8121013877551, -122.275144755102]"
10/22/2018 12:00:25,4014.0,1.0,2.0,1.0,4.0,1.0,3.0,3.0,Yes,3.0,Yes,"Community center, Playgrounds",1.0,Yes,No,Yes,https://drive.google.com/open?id=15opG7RDvlqB_NgV3lwquv96t5rMeYY9m,"3236 Market St, Oakland, CA 94608","The current state of the road. The pavement appears dark and recently paved, lane lines and crosswalks are replaced with messy spray paint guidelines.",https://drive.google.com/open?id=1joHLdYLrug5Au5-Y-f2TIp8RboB9rBqU,"3233 Market st. Oakland, CA 94609",Tagging on the face of the trashcan. The green face appears to have been covered up before.,https://drive.google.com/open?id=1Bmi7gdFufMI8IiXvjwFvqYmlC9C_GA3o,"3233 Market st. Oakland, CA 94609",The mural on the west Oakland Youth Center.,https://drive.google.com/open?id=1Vx_AGyutH115vwcdZNqYLUawPxQt5uWX,"A wall leading to a small play area for the youth center. A basketball hoop lays on the other sign, with a no trespassing sign on the wall.","3233 Market St. Oakland, CA 94609",https://drive.google.com/open?id=1E03N6JmEN1i8NSsQ4JCCRIBvtSjskCMp,"3208 Market St. Oakland, CA, 94608","An empty lot sits at the end of the block, surrounded by a fence. Graffiti can be seen in the background, and trash lays on the lawn next to the sidewalk. ","[37.8227219183673, -122.275805489796]","[37.8290193, -122.2743484]","[37.8290193, -122.2743484]","[37.8290193, -122.2743484]","[37.8225462040816, -122.27585177551]"
10/22/2018 12:36:50,4239.01,3.0,1.0,1.0,3.0,0.0,2.0,2.0,Yes,2.0,No,"Gas station, Liquor stores or Marijuana Dispensaries",2.0,Yes,No,No,https://drive.google.com/open?id=1yW4Qijl3MLszoxDCzQLBxbjRsgAwunAB,"2001 Emerson St Berkeley, CA 94703",The skin color in the graffiti was non-whites.  I thought it was due to the majority of population in this area is blacks.,https://drive.google.com/open?id=1j_sjRjbQrF8FvRCp46RTd8JDmg-UZbSv,"2001 Emerson St Berkeley, CA 94703","It was a residential apartment on the liquor store (where the graffiti in Image#1 was on the wall).  The face of the block is right in front of a wide road (Adeline St.), so I could imagine loud noises will bother residents. ",https://drive.google.com/open?id=1QaARrMumfYKbdY1DbEURAokx4qDyljiR,"2001 Emerson St Berkeley, CA 94703","Inside of the block looked more like residential area (and it was clean), but there was no enough grass between the door and the street of the houses. ",,,,,,,"[37.854305, -122.269028]","[37.854305, -122.269028]","[37.854305, -122.269028]",,
10/22/2018 13:49:40,4239.01,1.0,2.0,1.0,2.0,0.0,2.0,2.0,Yes,2.0,No,,3.0,No,No,No,https://drive.google.com/open?id=1GK9JXOqR5XURyC-dLRk2L3QKB9U4k0ON,,"This is a general picture of the street in the 4239.01 census tract. It is relatively shaded with trees and shrubbery, and has very light traffic. There are mostly just residential houses. ",https://drive.google.com/open?id=1y1mRh2veOh8IeFUD70SG9O-i8ElUrM8S,,"This is a picture of one of the flyers posted on the street. It depicts an event, and is written in Spanish, possibly showing that the demographic in the area is partially Spanish speaking. It seems family friendly, just like the entire street. ",https://drive.google.com/open?id=1S88BYfijn04v5Kf6TTenBzqIxEW5bEkY,,"Although the street is mostly clean and well-kept, there is some loose trash on the sidewalks. Most of it is cigarette butts, bits of paper and bottle caps.",https://drive.google.com/open?id=1Kl5iscCxZuqMCI9T2TYu1xyK9ElqQtbW,"This image shows a playground set in the front yard of a house. This shows that the families on this neighborhood are relatively well-off, and that there are families with young children. ","2022 Woolsey Street, Berkeley, CA, 94703",,,,"(37.8523001, -122.2675177)","(37.8523001, -122.2675177)","(37.8523001, -122.2675177)","[37.8522002682914, -122.266952668302]",
10/22/2018 23:01:24,4229.0,1.0,2.0,1.0,2.0,0.0,2.0,1.0,No,2.0,Yes,"Banks or credit unions, Bars and alcoholic beverage services, Community center, Eating places/restaurants, Liquor stores or Marijuana Dispensaries, Public library, Post office, Schools or daycare centers, Supermarkets/grocery stores",2.0,Yes,Yes,No,https://drive.google.com/open?id=1Zy4jfsaAfmYetUyW13ofXS-gWyMl_DnE,"2033 Centre Street, Berkeley, CA 94704","This is a renovating multi stories parking garage, which has shown that the need of parking spaces in the area. Other than parking spaces for vehicles, it is not hard to see that this parking building will also provide spaces for bikes. ",https://drive.google.com/open?id=1kba5oX9iV7XJ4vtQC87BaMMuEmdNSGEv,"2160 Shattuck Ave, Berkeley, CA 94704","An open area located in Shattuck Avenue, right next to the Downtown Berkeley bart station. There are tables and chairs for people to sit and rest. During the time I observed, there are two groups of people using the facility. ",https://drive.google.com/open?id=1TfwP8f8dia7ufVRlt5o7-SzQejSOv1x-,"2180 Milvia St, Berkeley, CA 94704",An official ballot drop box placed outside of the Berkeley Civic Centre. This facility has increased the connivence for citizen to vote. ,https://drive.google.com/open?id=11pnu5NtPE6UtGcJZih7MEH8XcldDxeQE,"A newly renovated entrance to Downtown Berkeley bart station. The entrance has used transparent materials, created a stylish and fancy look, which enhanced the appearance of the city. Other exits or entrances are still haven't renovated. ","2160 Shattuck Ave, Berkeley, CA 94704",,,,"[37.8701696926423, -122.269715048698]","[37.8701007, -122.2681385]","[37.8694472, -122.270795144079]","[37.8701007, -122.2681385]",
10/22/2018 15:17:51,4028.0,1.0,2.0,1.0,1.0,0.0,3.0,1.0,Yes,2.0,Yes,"Community center, Warehouses",2.0,Yes,No,No,https://drive.google.com/open?id=1ixUrnmxxv0yOWIoT3kFjrL8WkarCIQDE," 21st Street, Oakland, CA, 94607",In this picture you can see a new apartment building under construction and signs of graffiti on the trash can.,https://drive.google.com/open?id=10peHEHugb16HYonuT_Hx0U2ooy9v44o_," 21st Street, Oakland, CA, 94607",This picture shows a gated parking lot for the residential homes.,https://drive.google.com/open?id=1ponpfuZHZ__n424Ap_X92s0SbkFYxLYa," 21st Street, Oakland, CA, 94607",Recently developed apartment building as part of a gentrified street.,https://drive.google.com/open?id=1dGHHgHdbw2tMMj4GMgrbHJ76AMjCiySR,mental health facility ," 21st Street, Oakland, CA, 94607",https://drive.google.com/open?id=1Jp3whgPNrVMLONVsO4_eSKq3RsU_wawD," 21st Street, Oakland, CA, 94607",A new developed Christian boys apartment building.,"[37.8044557, -122.2713563]","[37.8044557, -122.2713563]","[37.8044557, -122.2713563]","[37.8044557, -122.2713563]","[37.8044557, -122.2713563]"
10/22/2018 15:25:57,4203.0,1.0,2.0,1.0,1.0,1.0,2.0,2.0,No,1.0,No,,2.0,No,No,No,https://drive.google.com/open?id=1d4ZNZPsaQ6YRtRSC-UT-SMK0zYdUWY6s,"943 Jackson Street, Albany, CA, 94706",Three houses in the middle of the block. Distinct color and style though some consistency in the design. The middle house appears in rougher condition with the old rusted car in the drive way. Another vehicle is covered up next to the car.,https://drive.google.com/open?id=1ZdUD6pLz79df_mtjoJPV1q5nYfHw3ZcG,,Car parked on street for sale.,https://drive.google.com/open?id=1HE04oe-pwyQQfyLBecXM8zY2Ss-aEF4t,"909 Jackson Street, Albany, CA, 94706","Larger parking area in front of white shed that lies between two residential buildings: larger white apartment-like complex (at least 4 units per building), and beige house. Lawns are dried up.",,,,,,,"[37.8888951428571, -122.301228142857]","(37.8906102, -122.3182668)","[37.8895369795918, -122.301427979592]",,
10/22/2018 16:38:09,4005.0,2.0,3.0,1.0,3.0,0.0,2.0,3.0,No,2.0,No,,2.0,No,No,No,https://drive.google.com/open?id=1CBfKktK-lNH4tkPNECQFFg_REQh3E6-F,"765-725 65th St Oakland, CA 94609",Caption 1 : This is a campaign advertisement placed by one of the residents of 66th street. It is advocating for the candidate Jovanka Beckles who is a mental health professional in Contra Costa.,https://drive.google.com/open?id=1_A_ABrRRucPQbPXENOVFcEJy4omdZT_M,"700-726 65th St Oakland, CA 94609","
Caption 2: This was placed outside an empty lot that will soon go through the construction of a building of commercial use, but also includes residential space. ",https://drive.google.com/open?id=1zgoSfkBDnCHOG0nR9LJIg5syjJDAF3bG,"700-726 65th St Oakland, CA 94609",Caption 3 : This is a babysitting advertisement posted on an electric pole. This shows that families do live in this area. ,https://drive.google.com/open?id=1cK2am2Bw0Nz_cfHiOuwFnHj83yXJqHjS,"Caption 4: A few of these houses had these security signs, which is a warning to anyone that tries to steal or harm the property.
","765-725 65th St Oakland, CA 94609",https://drive.google.com/open?id=152817s_AcTQYSCp0QMB18Ikg02j0Iyxo,"700-726 65th St Oakland, CA 94609","Caption 5: This patch of grass contains a variety of items that should probably be in the trash; this ranges from cigarette buds, to clothing items. ","(37.8485167, -122.2647445)","[37.850398, -122.266079]","[37.850398, -122.266079]","(37.8485167, -122.2647445)","[37.850398, -122.266079]"
10/22/2018 16:56:02,4217.0,1.0,2.0,1.0,2.0,0.0,2.0,2.0,No,1.0,No,Supermarkets/grocery stores,3.0,Yes,Yes,No,https://drive.google.com/open?id=1V4tmPwWKMhN-i9UP5ins4TQ2FbJ25O47,"1480 Shattuck Ave, Berkeley, CA 94709","The bus stop on Shattuck Avenue faces a large amount of businesses such as a book store, a nail salon, and restaurants. It is convenient for the inhabitants of this block to have many services at such a close range but also for those who come from neighboring blocks who have access to these services in close proximity to a bus stop. ",https://drive.google.com/open?id=1pgHgmAoIZUp8NjYG40AJdZwcxIAwlHZC,"1444 Shattuck Pl, Berkeley, CA 94709",The Safeway with bike racks in front indicate that perhaps it is common for many individuals from nearby blocks to grocery shop here. The Safeway in the middle of the block adds a large amount of vehicular and foot traffic to an otherwise calm and quiet block. ,https://drive.google.com/open?id=1bqkri8R37xQTZcTjPbm_j1niBltIuX7_,"1480 Shattuck Ave, Berkeley, CA 94709","This image shows two of the very few people of color observed in this block. The man is a private security for Bank of the West, while the women is collecting cans in a shopping cart and asking for spare change. ",,,,,,,"[37.8803948, -122.2695509]","[37.8809073, -122.2696792]","[37.8803948, -122.2695509]",,
10/22/2018 16:57:02,4203.0,1.0,1.0,1.0,1.0,1.0,5.0,2.0,No,1.0,No,Schools or daycare centers,3.0,No,No,No,https://drive.google.com/open?id=1Oyf6uxl4a_dvAiMi7_n1YLTF8WqoiAgu,"Jackson Street, Albany, CA 94706",sign of jackson street crossing with washington avenue,https://drive.google.com/open?id=19wKFgXCpWfHk9b2uobhyNoZNTGwjlDrJ,"Jackson Street, Albany, CA 94706",a resident was giving their used grill away and had a free to take sign on it,https://drive.google.com/open?id=1Yv8AAE9RYn2GoBjfPYkrvVe7GlQF0CDW,"Jackson Street, Albany, CA 94706",most cars were lined up across the street rather than in their driveways,https://drive.google.com/open?id=1-wf96MoH3hxQ4tpTNA-ITReWwvplqnR_,this is the children's center across the street,"Jackson Street, Albany, CA 94706",https://drive.google.com/open?id=14TPv3e1A7WhwYiansIvZurclYYcTwRj7,"Jackson Street, Albany, CA 94706",this is the abandoned stroller across the street,"[37.8835598, -122.2999737]","[37.8835598, -122.2999737]","[37.8835598, -122.2999737]","[37.8835598, -122.2999737]","[37.8835598, -122.2999737]"
