10/24/2018 1:41:32,4201.0,1.0,1.0,1.0,2.0,0.0,1.0,1.0,Yes,2.0,Yes,"Parks, Playgrounds, Schools or daycare centers",3.0,No,No,No,https://drive.google.com/open?id=1Z-oucLPwuNFEBHzbXqnT1E07MbZDRVii,"1325 Portland Ave, Albany, CA 94706","Photos of the community gardens at Memorial Park in Albany, CA",https://drive.google.com/open?id=1VyPhxcdSZh1jTIO-GBZx-4cBklD-9jgb,"1325 Portland Ave, Albany, CA 94706","Recreational facilities at Memorial Park: enclosed playground for toddlers (top), resident exiting dog park (middle left), public grill/fire pit area (middle right), families gathered at large play structure (bottom)",https://drive.google.com/open?id=1hmxtpogSza0gp39VtSjKiKAJJvEhmqhV,"1325 Portland Ave, Albany, CA 94706","Waste management/vandalism: (top) graffiti on a table near the enclosed playground; (bottom - left to right) a grill pit filled with litter, waste management compost bins, one of several trash/recycle/compost containers surrounding the playground",https://drive.google.com/open?id=1DQw3ksHcZY6RZS3AtRWYe5G6b4IQq_p4,"KISS: Kids Speaking Spanish, a Spanish-immersion pre-school program. ","1331 Portland Ave, Albany, CA 94706",https://drive.google.com/open?id=1Cc6LsfCBiCVMPN1vklNMbuMLmi4os0Aa,"635 Carmel Ave., Albany, CA 94706",One of several houses on the block that displayed political signs on their property.,"[37.89559215, -122.290822536266]","[37.89559215, -122.290822536266]","[37.89559215, -122.290822536266]","[37.8948849185349, -122.290664283144]","[37.8956399683506, -122.289902173869]"
10/24/2018 1:55:42,4033.0,1.0,2.0,1.0,1.0,0.0,1.0,1.0,Yes,3.0,No,Public library,3.0,No,Yes,Yes,https://drive.google.com/open?id=1YCotpid0nJPa_yKKM3TDyz-QD6xlwAmj,"125 12th St #100, Oakland, CA 94607","Because the library was surrounded by county and official buildings, the conditions of the block face was well-kept and fairly calm.",https://drive.google.com/open?id=1HR-7MXX_Fxvllx--NYTFJs3rAlbcKVt_,"120 11th St, Oakland, CA 94607",This was the only religious building in the area. Its Chinese writing coincided with that of the street signs.,https://drive.google.com/open?id=1voSUrwrqVfSADkL2gJGEDxJsWo5NTfUs,"149 11th St, Oakland, CA 94607",This was across the street from the church. Fence was not too high but barbed wire was surprising to see in this particular spot.,https://drive.google.com/open?id=1WikV4tQhnM4L8e-WMGKwU68fPW2rOb7z,Located outside the Alameda County Clerk-Recorder office building. Cigarette buds could be caused by those working in this building.,"1106 Madison St, Oakland, CA 94607",https://drive.google.com/open?id=1_Fr_0AQSn6yVBnoJdchez4nMBZnJSee8,"1221 Oak St, Oakland, CA 94612",Located across 12th st. Upkeep shows consistency.,"(37.7944308, -122.2663244)","[37.7992721666667, -122.264659666667]","[37.7996107340353, -122.266013196111]","[37.7968069, -122.2670203]","[37.8004658, -122.26327]"
10/24/2018 1:56:33,4239.01,1.0,2.0,1.0,1.0,3.0,3.0,2.0,Yes,1.0,No,"Manufacturing, Supermarkets/grocery stores, Warehouses",3.0,No,No,No,https://drive.google.com/open?id=1bHvBIKhKD_Mswqs6VabNk4aKXcqMmiCX,"2034 Essex St., Berkeley, CA, 94703",It demonstrates the many cars and trees on the sidewalks. ,https://drive.google.com/open?id=1c-K0ZxQKLnz15p_sDVdGKRyvult4m5tx,"3048 Shattuck Ave., Berkeley, CA, 94703",This photo shows graffiti and lesser trees than the rest of the block. ,https://drive.google.com/open?id=1ayoBN3xb2jFA9H2OdBoiy0tNWC70VDBT,"2007 Essex St., Berkeley, CA, 94703","We can see this house has a wheelchair sign, showing care for the disabled. ",https://drive.google.com/open?id=1G9ct1T4eGyrq4O5cTaXMINrKFgTTHMcS,"There is a person and nice houses, showing an affluent neighborhood. ","2024 Essex St., Berkeley, CA, 94703",https://drive.google.com/open?id=1X6VJHHZ8ZEPhsh_a7c6I2tvNv0j57q0w,"2024 Essex St., Berkeley, CA, 94703","There seems to be some sort of a shed, and there is also a motorbike, a rare sight in Berkeley. ","[37.8535880427933, -122.267571301641]","[37.8667724, -122.2677605]","[37.8536873144386, -122.268067215455]","[37.8535654881875, -122.267735893164]","[37.8535654881875, -122.267735893164]"
10/24/2018 2:10:54,4006.0,1.0,1.0,1.0,2.0,0.0,1.0,2.0,No,2.0,No,,2.0,No,No,No,https://drive.google.com/open?id=1yFzMJCILceWzPZUSV7x-yZdzcYCfPQCn,"673 57th Street, Oakland, CA, 94609",Only building under any visible renovations. ,https://drive.google.com/open?id=1wH8DJFd2ygB9RX4DqhQJyc4bZXZ7rBtY,"640 57th Street, Oakland, CA, 94609",The only house with visible Halloween decorations. ,https://drive.google.com/open?id=1p27lDGuK25Yv2Q9tNOzzoqIPNyuW03nW,"646 57th Street, Oakland, CA, 94609",Example of a duplex on this street. ,,,,,,,"[37.8422715681278, -122.267018605737]","[37.8425570986673, -122.26610886039]","[37.842535567487, -122.266265340517]",,
10/24/2018 2:15:37,4031.0,2.0,4.0,3.0,4.0,0.0,4.0,3.0,Yes,1.0,No,"Eating places/restaurants, Parks, Playgrounds",2.0,No,No,Yes,https://drive.google.com/open?id=15H6hm3J3Bq_p0L952jCWQ4rrk3UPt8bT," 555 12th St Oakland, CA 94607 ","This is the side of the block going towards 11th Street where you can clearly see the newer buildings. However, you are also able to see the difference in blocks with the trash that is located on the block I have chosen.",https://drive.google.com/open?id=11POHEm97JUx3OmpN0SeAWmoM2JL4gBM0,"Lafayette Square Oakland, CA 94607","This is the block that faces the street I have chosen. There is a park area open to the public, and it is mainly being used by older male individuals as smoking spot although there is a playground present right next to them.",https://drive.google.com/open?id=1hXMDNC0niLi2XGvOCHb51mbxdTUQVSQm,"901 Jefferson St Oakland, CA 94607","This is the block going towards 10th Street. As you can see, there are renovated apartments. This is just a 10 step walking distance away from my block and there is a large difference in the living conditions of the people on these blocks. ",https://drive.google.com/open?id=1hpUWPjmUanWiDKWQfK8jhMYnRzzg4VRH,This is a picture of the gutters of the block I chose. You can see that there are condoms on the floor along with cigarrete buds and other trash. The whole block has trash like this. ,"1000 Jefferson St, Oakland, CA 94607",https://drive.google.com/open?id=1LcGk7_11sSCr5cPE4pjrIxjOAsWe1LBz,"577 11th St, Oakland, CA 94612","With this picture, you can see how “poorly” maintained the building is in the sense that it has lots of graffiti on it. You can also see how it is apartments on top of businesses, but they look nothing alike to the buildings surrounding it. ","[37.803536, -122.2750401]","[37.8035656, -122.276890721336]","[37.802441, -122.277004]","[37.803053, -122.276381]","[37.8034640485874, -122.275805034285]"
10/24/2018 2:19:50,4212.0,1.0,1.0,1.0,1.0,0.0,3.0,1.0,Yes,1.0,No,,3.0,No,No,No,https://drive.google.com/open?id=1tneWrhaL777hEhPE_n1cgkrp1r2N7_mY,"801 Shattuck Avenue, Berkeley, CA",Found these signs at the entrance of the park ,https://drive.google.com/open?id=1qSNj8CuK56qGG8L6f7qPEsdND_amZZD6,"807 Shattuck Avenue, Berkeley CA",Found several houses with this sign in their yards ,https://drive.google.com/open?id=1N75DP--AqXDbPpQCGK10q95e3OLbqaMc,"944 Shattuck Avenue, Berkeley CA",Graffiti was found on almost every bin in this area ,,,,,,,"[37.892009, -122.27237]","[37.8919258, -122.2719753]","[37.8904021539773, -122.269542775869]",,
10/24/2018 2:32:08,4202.0,1.0,2.0,1.0,2.0,0.0,3.0,1.0,Yes,2.0,No,"Auto repair/auto body shop, Eating places/restaurants",2.0,No,No,No,https://drive.google.com/open?id=1O3nd_wcxr9LY5Q0xeocxBn-HJn-E4kxi,"1114 Brighton Ave, Albany, CA 94706","The street was actually pretty nice, no potholes or roughness. The lawns and areas around the block were also very neat yet in front of one house on the block, There was a huge pile of garbage. While I know what garbage can implicate as it is mentioned in the survey. It can imply a lack of ability or want to care usually within a poorer society- but this seems more like an anomaly like a garbage person dropping part of the house’s garbage without realizing. ",https://drive.google.com/open?id=1oklkSV0KlbwIgDB7Qdam-pScYyjIbcNw,"1101 Brighton Ave, Albany, CA 94706","My main point in taking this specific photo is what it shows about the neighborhood, it is clearly a youth’s bike whether young 20s or a middle schooler. However, the importance comes with how the person left the bike. The bike was chained to the post with a fancier chain than the ordinary $5 one from Walmart which indicated a certain amount of wealth. The helmet was simply clipped to the side and things were left in the basket which implies a certain amount of trust in the area. I never saw the owner come back for her bike and even otherwise I wouldn’t be able to guess if she was a resident nearby. However, the bike itself was very indicative.
",https://drive.google.com/open?id=1nrA_SBZhtJnMnoGZQWPu3twdyZu9l12a,"540 San Pablo Ave, Albany, CA 94706","This is a photo of the picture painted on the side of the bowling alley and while it was not on my block face, it was very clearly visible standing on the block face and looking across the street to the Bowling Alley on San Pablo, I found it interesting the statement that the owners and potentially the area is trying to make with the emphasis of “ since 2003”. A lot of areas strive for character and something personal and establishments that have been around for awhile tend to accomplish that. My city back home has a movie theater that has been around since the 20s, what it attempts to do is to take the current commercialization and add nostalgia which has economic and class implications in a comericalized, developed area. ",,,,,,,"[37.8966968, -122.300227790065]","[37.896977, -122.299999]","[37.8961913, -122.3010785]",,
10/24/2018 7:58:51,4203.0,1.0,1.0,1.0,1.0,1.0,3.0,2.0,No,1.0,No,,1.0,No,No,No,https://drive.google.com/open?id=1AzgKsVPZu8ZeB5inj_eT0ZC75Eg9amtw,"CLay St, Albany, CA, 94706",The houses were located on a uphill landscape so all the houses had 2 flights of stairs.,https://drive.google.com/open?id=1VnTVEy1sP-2dD98bc1aoA-FZEEv7FUQ4,"Jackson St, Albany, CA, 94706",The opposing street was a park so it was not fully developed.,https://drive.google.com/open?id=152qy-h4JyaB4Ud3ITRlv0bGiNmJ1Mo_2,"Jackson St, Albany, CA, 94706",The area is a fire prone,,,,,,,"[37.8960324, -122.3009447]","[37.8835598, -122.2999737]","[37.8835598, -122.2999737]",,
10/24/2018 8:20:12,4213.0,1.0,1.0,1.0,2.0,0.0,2.0,1.0,No,1.0,No,,3.0,Yes,No,No,https://drive.google.com/open?id=1xNVJ8w1WXRaVunhCJ6OcsKOS_304wmiZ,"1727 Sonoma Ave Berkeley, CA 94707","I noticed this neighborhood is 100% residential. Many of the homes are single unit houses with their own lawn, driveway, and backyard. I also noticed a handful of local election signs on the street. The street was nice to drive down because there were a lot of trees on the sidewalk and mostly stop signs/almost no traffic lights. ",https://drive.google.com/open?id=1I4DidIc06Shuj6vvk4erKmHD8THsnVca,"1004 Ventura Ave Albany, 94706",The house sizes range from large to small. This house was a smaller house I noticed and I thought this neighborhood might have been here for a long time from the architecture. I think smaller houses like the one in the photo are common back in the 1950s or 1960s. ,https://drive.google.com/open?id=1IYwwnsrL5weY2rqs4fekMJVUjSia1LJ3,"1504 Beverly Place Berkeley, CA 94706","This neighborhood had an overall well landscaped garden. There were a lot of plants, bushes, and tree everywhere which created a scenic route to walk within the neighborhood. I did not run into many people during my observations but I could hear kids nearby and maybe a school. ",,,,,,,"[37.886478, -122.281097]","[37.8866117890428, -122.283759288247]","[37.8860642045267, -122.283452068097]",,
10/24/2018 8:40:16,4203.0,1.0,3.0,1.0,2.0,0.0,3.0,1.0,No,2.0,Yes,"Community center, Eating places/restaurants, Schools or daycare centers",3.0,Yes,No,No,https://drive.google.com/open?id=1qeRKijHF_BHFDFYP7Q-cLeRz4odTobvF,1216 Solano Ave,YMCA Daycare Center,https://drive.google.com/open?id=1uiu8Hxxu9RJ6TJ1UZukgkmYdf9zFu4Mw,1216 Solano Ave,Bus stop in front of the YMCA Daycare center,https://drive.google.com/open?id=15YA227LEhQTs9djgpHo5YS5vJip--VtQ,,People walking their young children.,,,,,,,"[39.4543626666667, -75.0513423333333]","[39.4543626666667, -75.0513423333333]","(37.8906102, -122.3182668)",,
10/24/2018 8:55:10,4027.0,3.0,2.0,2.0,3.0,1.0,2.0,2.0,Yes,3.0,Yes,"Bars and alcoholic beverage services, Community center, Fast food or take-out places, Gas station, Liquor stores or Marijuana Dispensaries, Parks, Playgrounds, Schools or daycare centers",2.0,Yes,No,Yes,https://drive.google.com/open?id=1TE-3Sgdjei-7vIcJURmyTTXfVN9pv3YX,"17th and West st. Oakland Ca, 94607",This is the entrance of Marston Campbell park. To the left of it it is a charter school called Kipp Bridge Academy. In the background I noticed the semi high project apartments(Market st.).  On the opposite side of the camera are just normal individual houses,https://drive.google.com/open?id=12KbOu3QRFyrReCANQofvw54dhmPMepAr,"799 West st. Oakland Ca, 94607",This is a drug store that stays open 24/7.,https://drive.google.com/open?id=13LdUflBPGmk6COubnQuQ1saI7BE2qEoV,"1700 Market st. Oakland Ca, 94607",This is  Kipp Bridge Academy. A charger school for those of the neighborhood.,https://drive.google.com/open?id=1hY9SBgJnSQAOsB6TZA3my-zQXKcE2gPI,This is a Rec center where boys and girls can go play at. The center is normally very busy after school as kids wait for their parent to pick them up.,"1825 Market st. Oakland Ca, 94607",https://drive.google.com/open?id=1EqqBUYcleBX4dMPaqG4Me-Nhl4oZKioV,"1741 Market st. Oakland Ca, 94720",A liquor store that sits right across fork school grounds.,"(37.8103872, -122.2769914)","[37.805886, -122.2805487]","[37.8114162258713, -122.279555616207]","[37.8114033469388, -122.279952326531]","[37.811043, -122.280172936693]"
10/24/2018 9:46:58,4007.0,2.0,1.0,1.0,2.0,2.0,2.0,1.0,No,2.0,No,,2.0,No,No,No,https://drive.google.com/open?id=1d8wgOLchaunxxQzyq64O71MIkw_5Gtdv,"882 61st St, Oakland, CA, 94609","This was the only seemingly vacant house on the block, as all of the bottom floor windows were blocked off with wooden panels. The house also looks worn out and the steps look like they have not been swept in a long time. There are cobwebs accumulated along the edges of the mailbox. ",https://drive.google.com/open?id=1E4OttYkus_6dlYa1HP3AvhtdNzW_EdlW,"882 61st St, Oakland, CA, 94609","This is a picture of the front yard of the vacant house. The grass and greenery is mostly brown and dry, and looks like it hasn't been cut or watered in a long time. There is also a single, empty bottle of what looks like to be beer on the ground. The house is surrounded by wire mesh fencing. ",https://drive.google.com/open?id=1AJGCjq-kqndpIskd9BNSZd3yjxASd93V,"858 61st St, Oakland, CA, 94609","This image is interesting in that the house (duplex?) itself is in quite nice condition, except there are obvious indicators that they want to be protected from intruders. Along with the ""BEWARE of DOG"" sign, there seems to be a bell attached to the wire mesh gate, which would ring if anyone tried opening the gate. There is also a security system installed as indicated by the Bay Alarm sign.",https://drive.google.com/open?id=1nQ2oRcyKFfR8YiG9HlkANX-BXCmD02zd,This sign was the only piece of political propaganda on the street. Measure E supports the continuation of funding for Peralta Community Colleges and the allocation of funds towards academic over administrative purposes. Measure G supports the use of funds to upgrade old classrooms and other equipment for Peralta Community Colleges. What's interesting about this is the fact that whoever chose to put this sign up chose to place it here in this neighborhood.,,,,,"[37.8456243333333, -122.274682333333]","[37.8456243333333, -122.274682333333]","[37.8456908333333, -122.274000333333]","(37.8417578, -122.2723135)",
10/24/2018 9:50:25,4224.0,1.0,1.0,1.0,1.0,0.0,3.0,1.0,No,1.0,No,"Auto repair/auto body shop, Schools or daycare centers",2.0,No,No,No,https://drive.google.com/open?id=1L2JxhMfmUqHdCql4cAvrBlpOkTV2Bnly,"2015 Francisco St Berkeley CA, 94709",There were multiple political signs on the block. Most were on people lawns promoting candidates they would vote for.,https://drive.google.com/open?id=1gmkIXMBU_9EgVM-KEtwZOZEs85jXghpN,"2030 Francisco Street Berkeley, CA 94709","This is an image of the Berkeley School Early Childhood Campus. Walking into the block it seems mostly residential but, this school is hidden. Most of the students getting out of school were waling home with their parents as they live on the block.",https://drive.google.com/open?id=13lbCDL-cvmWSX6-NcL0XgzvnH2YVmZYs,"1752 Shattuck Ave Berkeley, CA 94709",This was one of the two establishments on the block. It was the first thing on the block.,,,,,,,"[37.8756323, -122.2703968]","[37.87537435, -122.269468170856]","[37.8753467, -122.269145]",,
10/24/2018 10:29:46,4201.0,1.0,2.0,1.0,2.0,0.0,5.0,2.0,No,1.0,No,,1.0,No,No,No,https://drive.google.com/open?id=13sbJ9yBiAaxekgE7u1cnYY-YDfVRsXUp,"N/A, because it is a picture of a car","This car was extremely different from the one included in Image #2, but it was interesting how both of them were parked on this street. This implies that there could be a variety of people from different socioeconomic backgrounds living together on this street. ",https://drive.google.com/open?id=1A7PnfkBYFXel8AqzLiHTDcXXy4H4Xz5m,"N/A, because it is a car.",This car is a fairly new BMW as opposed to the old Mitsubishi pictured above. This simply indicates the difference in taste and access to life chances among the residents of this street.,https://drive.google.com/open?id=1hC1qBkCruIFNd_gqBBopNbh-8k68wbZR,"613 San Carlos Ave., Albany, CA, 94706","This depicts a comparatively older house than the house pictured in the next image. As opposed to the cars, this simply shows a slight difference among people's economic abilities on this street. ",https://drive.google.com/open?id=1dlaENV93j3bqo5oj7lmSbTaWT5nA4yO5,"This house seems to be recently renovated and painted, as opposed to the house in Image #3. It's interesting to see such a difference among houses that are so close to each other.","631 San Carlos Ave., Albany, CA, 94706",,,,"(37.8947731, -122.2910214)","(37.8947731, -122.2910214)","[37.8962868364934, -122.289001501856]","[37.8959911166593, -122.28901627086]",
10/24/2018 10:34:46,4033.0,1.0,5.0,1.0,2.0,0.0,1.0,3.0,Yes,2.0,No,"Bodega deli corner-store convenience store, Eating places/restaurants, Fast food or take-out places, Parks, Playgrounds, Schools or daycare centers, Supermarkets/grocery stores",1.0,Yes,No,Yes,https://drive.google.com/open?id=1wu7NNC9mUvfpBW2rEnsCI9uFcPx7AGb_,241 Tenth St. Oakland Ca 94607,"This Asian market on 10th street is where all locals could go to find all the imported Asian goods such as spices, foods, etc. ",https://drive.google.com/open?id=1wt3Z6IFjKQj2aQKEbMqv3jHduq6GTE_H,"268 Tenth St. Oakland, CA 94704",Instead of graffiti the block was mostly covered with colorful murals that captured symbolic images of the Asian culture. ,https://drive.google.com/open?id=134rpzjbSvNs1eZ-JLWR5-y8gYrTEKhrv,"923 Alice St. Oakland, Ca  94704",There was not a lot of trash in the streets most wrappers and cigarette butts were found near a gutter or under this electric box. ,,,,,,,"(37.7944308, -122.2663244)","(37.7944308, -122.2663244)","[37.7992532431027, -122.268554887508]",,
10/24/2018 10:58:26,4006.0,1.0,1.0,1.0,2.0,0.0,2.0,2.0,Yes,2.0,No,,3.0,Yes,No,No,https://drive.google.com/open?id=1_xDMmGX7lqyJAKQDeGZ5R6Gee95J61tz,"549 57th St, Oakland CA,  94609.",It is a residential area and most housing types are duplex. And there are grasses and other plants between the block face sidewalk and the unit.,https://drive.google.com/open?id=1-Pp7u399dus4GXAxzQA9YC86e5dgaJMd,"501-599 57th St, Oakland CA, 94609.",There are many cars parking on both sides of the road. And over half of them are Japanese cars like Honda and Toyota. The road condition is not very well as there are many visible cracks on it.,https://drive.google.com/open?id=1n2Jekto7-EG8ZvaKem-OXWdc3GO04l8e,"689 58th St, Oakland CA, 94609.","It is a Home Alert Neighborhood sign near the 57th block.
",https://drive.google.com/open?id=1SgFeJUXFYPqV4fGPkKQaGgv_r2abDIuO,"Near the 57th, there are some wooden pillars with some personal notices on it. And there is no special places for residents to post personal notices.","631 58th St, Oakland  CA, 94609.",,,,"[37.8428089329417, -122.263594756783]","(37.8419909, -122.2648882)","[37.843181738932, -122.267549148273]","[37.843367146913, -122.266087005167]",
10/24/2018 11:02:57,4213.0,1.0,1.0,1.0,1.0,0.0,2.0,1.0,No,2.0,No,,3.0,No,No,No,https://drive.google.com/open?id=1PUmgPqIRp5hkUsdw2ya4nOO-oZoQ-Bk9,"930 Colusa Street, Berkeley, CA, 94707",Luxury cars line the street,https://drive.google.com/open?id=1j8yg4yXELMOA2i1wUw0usxhMl2UlD1Th,"930 Colusa Street, Berkeley, CA, 94707",Trees line the block with houses set back,https://drive.google.com/open?id=1cQ7ad-lTdLU42S4YQwnz9_SocdVdywus,"930 Colusa Street, Berkeley, CA, 94707",Some people stop and chat off the side of the road,,,,,,,"[37.890694640209, -122.279269108562]","[37.890694640209, -122.279269108562]","[37.890694640209, -122.279269108562]",,
10/24/2018 11:03:10,4217.0,1.0,1.0,1.0,2.0,0.0,3.0,1.0,No,1.0,No,"Banks or credit unions, Bars and alcoholic beverage services, Eating places/restaurants, Post office, Professional offices (doctor dentist lawyer accountant real estate), Supermarkets/grocery stores",3.0,Yes,Yes,No,https://drive.google.com/open?id=1yQhrPSWofVIKlf2_fI4d9upX4q8cyYqh,"1550 Shattuck Ave, Berkeley, CA 94709",This Safeway Community Market and its parking lot takes up most physical space on the block. ,https://drive.google.com/open?id=1rR3CrgzUrtt4CZpy8IVIFEdtnRxbvXa0,"1531 Shattuck Avenue, Berkeley CA 94709",This is one of the three apartment buildings in this block. It has a small parking lot in the front. ,https://drive.google.com/open?id=1aFn1GG0A07pqEUnyao_XO3UcC3tb_f-y,"1536 Shattuck Ave, Berkeley, CA 94709",This Bank of America had a private security guard in the entrance. ,https://drive.google.com/open?id=1y-2OgqACZ4QBFwOj6Sg85LUwCdTgzUp0,This was the only art gallery in the block. ,"1505 Shattuck Avenue, Berkeley, CA 94709",https://drive.google.com/open?id=1jfDHc2BfibpdCtw2zuSU8xoYtXF_cpiM,"1521 Shattuck Ave, Berkeley, CA 94709",This US Post Office is the only government-owned establishment in this block. ,"[37.8788525, -122.269976578391]","[37.880072, -122.269123]","[37.8787966326576, -122.269002779794]","[37.8799788, -122.2690696]","[37.876551, -122.2688407]"
10/24/2018 11:05:31,4206.0,1.0,1.0,1.0,2.0,0.0,2.0,1.0,No,1.0,No,Professional offices (doctor dentist lawyer accountant real estate),3.0,No,No,No,https://drive.google.com/open?id=1FPhYomKqIaMEEZ9e3HvWVbei8YFmW90K,"918 Ordway Street, Albany, CA, 94706.",This is the section of Ordway’s sidewalk under construction and is the only big project on an otherwise well-built street.,https://drive.google.com/open?id=1K3NEvwQMVzljgxN02qxx8AiOc32jEwMG,"921 Ordway Street, Albany, CA, 94706.",Different sections of the sidewalk along Ordway are of varying conditions. They are all generally walkable but newer portions with newer landscaping often contrast with older segments with more meagre efforts dedicated towards landscaping.,https://drive.google.com/open?id=1usPOvVO2BopoFx5rqBcz7XYfvrkyaIr7,"900 Ordway Street, Albany, CA, 94706.",The facade of the two offices hosting two small business wrapping around the corner of Ordway and Solano. The size and color of the facade helps the businesses integrate well into the general appearance of the block.,https://drive.google.com/open?id=10VkzxJ6seGSRudOdIV3LXzNzGslHqPF6,A sign indicating that the sidewalk rehabilitation project was funded by Albany’s Sidewalk Parcel Tax.,"918 Ordway Street, Albany, CA, 94706.",https://drive.google.com/open?id=1a_qffRhZCkdQA3W6WmSis7nWW86Ebq_q,"Ordway Street, Albany, CA, 94706.","Ordway Street is generally, a generic street within a suburban area. It is highly residential, is well-paved, has trees lining the curbs, and is very clean, with no public eyesores.","[37.8906139369315, -122.284564464658]","[37.890602106176, -122.284331955318]","[37.890898, -122.284592]","[37.8906139369315, -122.284564464658]","[37.8867565, -122.2845162]"
10/24/2018 11:06:57,4033.0,1.0,1.0,1.0,3.0,1.0,2.0,3.0,Yes,2.0,No,"Professional offices (doctor dentist lawyer accountant real estate), Schools or daycare centers, Supermarkets/grocery stores",2.0,No,No,No,https://drive.google.com/open?id=1DfiSpLP9MDH3eEpqsr2Jy4uHgt6hG_iW,"211 10th st. Oakland, Ca 94607",across from an elementary school next to a duplex,https://drive.google.com/open?id=16Qh3igXz6TVGXQZbnYoBu7oEwB9xkr2H,"237 10th st. oakland, Ca 94607","one of three duplexes, this one turned into a business. 
",https://drive.google.com/open?id=1JFRsfPZl3avU7yB3TqPL5FtGqgEAtswl,"225 11th st. Oakland, ca 94607",shattered glass on sidewalk. this is taken on the other side of the school which is located on 10th st.,,,,,,,"[37.7992555278443, -122.267265115145]","[37.7994707189595, -122.267830313675]","[37.8004583239763, -122.268145735173]",,
