10/30/2019 15:42:31,4006.0,1.0,1.0,1.0,2.0,0.0,2.0,1.0,No,1.0,Yes,,3.0,No,No,No,https://drive.google.com/open?id=1m6Tv0a8CvcIlKwkIygWtsE5uUACjtpyN,"532 Aileen Street, Oakland, CA, 94609",The most affluent-looking house in the area.,https://drive.google.com/open?id=1VujvUh7lGQq1mD2KCFdSHNUCZ4JNnkoq,"5636 Shattuck Avenue, Oakland, CA, 94609",View across Shattuck to the other side of the census tract. Houses on that side were visibly more run-down and unkempt.,https://drive.google.com/open?id=1kcsMKnGVEnOfWTGO3gTl9evqvYCfqTLZ,"532 Aileen Street, Oakland, CA, 94609","""Neighborhood watch in effect"" sign and a vintage car in the background. ",,,,,,,"[37.8420003683778, -122.263050006625]","[37.841844, -122.264586857143]","[37.8420003683778, -122.263050006625]",,
10/30/2019 15:57:13,4202.0,1.0,2.0,1.0,3.0,0.0,2.0,1.0,No,3.0,No,"Auto repair/auto body shop, Manufacturing, Supermarkets/grocery stores, Warehouses",2.0,No,No,No,https://drive.google.com/open?id=1UbrLO5YlYOp4ap1jOH08S10lusvcLKES,"1061 Eastshore Hwy, Albany, CA, 94710",This is the only signage for public events on the street. It is knocked down even though halloween is not yet over. People probably wouldn't notice this even if they were walking though the street.,https://drive.google.com/open?id=1Yd5v6mCEJAvzvZHbGFhK0YBHhflcinZF,"1077 Eastshore Hwy, Albany, CA, 94710","Image of the only housing on the street. It seems fairly new, without visible damage. Plants are trimmed well. Paint job seems fairly new. ",https://drive.google.com/open?id=1ql5grpsxnvd58ElG-yY7lboeQD_BFnz0,"1077 Eastshore Hwy, Berkeley, CA, 94710",Sauna Store. I have personally never seen a sauna store and found this very interesting ,https://drive.google.com/open?id=1U4kSWyt9-baBokaWo6QxXWToOmpUgdOJ,Car Toyota Dealership/Car service center. It was fairly empty and lacking workers for a Saturday afternoon. ,"1025 Eastshore Hwy, Berkeley, CA, 94710",,,,"[37.8840410428334, -122.307969513642]","[37.8832271300614, -122.307828665793]","[37.8800688, -122.3072353]","[37.8800688, -122.3072353]",
10/30/2019 16:24:57,4201.0,1.0,1.0,1.0,1.0,0.0,1.0,1.0,No,1.0,No,"Banks or credit unions, Chain retail stores, Eating places/restaurants, N/A",3.0,Yes,No,No,https://drive.google.com/open?id=1hEtTPOh4ZFEVGYvcDQmG6q2S_mxPLgqH,"850 Carmel Ave, Albany, CA, 94706","This picture is representative of how the majority of houses on Carmel Ave look like. The street (sidewalk) and the house, are divided by a nice, well kept garden. The house does not have any bars or gratings on the windows. It is a well kept conditions. What I find really interesting is the cure of the cutting of the bushes/trees in a very precise form. This means people look after their garden. ",https://drive.google.com/open?id=1ZRhRdXT0Bxuj-UMwQlcop3dw9jYuukZS,"827 Ramona Ave, Albany, CA, 94706","This is an image of one of the only signs I saw throughout the block. It is very welcoming, and nice. It is placed in a very well kept garden. It is representative of how nice, polite and welcoming the people in the block were to me. It is a sign that portrays very strong political ideals in a 'calm' manner. ",https://drive.google.com/open?id=1Y0UivkD3nUCIQp61y5RW1XrVfP9PZcFi,"1373 Solano Ave, Albany, CA, 94706","This is a picture of the restaurants/shops on one side of Solano Ave. These are in the middle of the crossings of Ramona Ave and Carmel Ave. These shops/restaurants/ are little, well kept. The biggest more 'commercial' one is the bank. Not many people were around. Even though it is the Main Street it is still very clean and mostly lined with trees. ",https://drive.google.com/open?id=1H88fxycKM4Sk355Gd3Xs28fK06Ayi9dy,"I do not know if this can be considered as a relevant picture for the representation of the block. However, I found it really interesting as usually in other CVS stores these products are mostly locked, and if a customers wants to buy one they have to ask one of the people that work there to unlock it. Here instead they were open to people to take, which probably means they are not as afraid that someone would steal them. CVS was very cleaned in comparison with others on Shattuck and employees were very friendly and nice. ","1382 Solano Ave, Albany, CA, 94706",https://drive.google.com/open?id=1kvQqkPMeRAhtQV8d8HR35kQsanb_8G3W,"836 Ramona Ave, Albany, CA, 94706","This picture shows how all houses are single residency houses. The street is clean, lined with nice trees. Cars are parked outside the houses. Traffic is very low. All houses have a garden in front that divides them from the street. All houses are different. ","[37.8917977930814, -122.290299944649]","[37.8922745414044, -122.290920601769]","[37.8907962222222, -122.290576388889]","[37.89053055, -122.290447897049]","[37.8920797341807, -122.291137415095]"
10/30/2019 16:33:49,4213.0,1.0,2.0,1.0,2.0,0.0,3.0,2.0,Yes,2.0,No,,2.0,No,No,Yes,https://drive.google.com/open?id=10fKR7nYxoXoFfaSqyY3j7qR4Id2LvvLH,"2430 Encinal Avenue, Alameda, CA, 94501",,https://drive.google.com/open?id=11ywazNItiPInoL3HFSXBdlKvh00w3ytQ,"2430 Encinal Avenue, Alameda, CA, 94501",,https://drive.google.com/open?id=1K_RCZjaWTu3SL4G7sXc1-ZyGVxYiMtU6,"2430 Encinal Avenua, Alameda, CA, 94501",,,,,,,,"[37.761991875, -122.24322875]","[37.761991875, -122.24322875]","(37.8911093, -122.2813663)",,
10/30/2019 17:43:38,4202.0,1.0,1.0,1.0,2.0,0.0,3.0,2.0,No,2.0,No,,2.0,No,No,No,https://drive.google.com/open?id=1g1ojcyi6aRiF2A4c_tCpuLj0uIPqBUkK,"1400 Stannage Ave, Berkeley, CA , 94702","The streets are very clean, the houses look a little old and need some gardening from the strong winds. As seen in the picture a branch from the tree fell.",https://drive.google.com/open?id=1PO6-wAptJybIcRnRF9LQDiwYcUvkvYGN,"1400 Kains Ave, Berkeley, CA, 94702",Throughout the block there was a couple of political and peace signs/posters. One of them including a Bernie sign in a homes front yard. Another home had a poster on their window promoting equality for all. It is easy to assume this neighborhood might be liberal.  ,https://drive.google.com/open?id=19t4_G8tdC0nyairirJJTV2BHNZckLbvF,"1160 Page St, Berkeley, CA, 94702","The neighborhood is very quiet, a lot of trees. Most of the sidewalks are cracked and very uneven, I'm assuming it is because of the roots of trees that grow.",https://drive.google.com/open?id=1xDX12vfDCCgJr2kakv9oXLo3uTLTG_AC,"Like stated before, there are a lot of plants, most of them are dead or overgrown. A lot of homes need to do gardening, I'm assuming the residents are busy people and do not have enough time to garden. ","1437 Stannage Ave, Berkeley, CA, 94702",,,,"[37.878923, -122.293599]","[37.878751, -122.29442]","[37.8777091844918, -122.293541104117]","[37.8776710117217, -122.292972410753]",
10/30/2019 17:51:25,4229.0,1.0,2.0,1.0,2.0,0.0,5.0,2.0,Yes,2.0,No,"Bars and alcoholic beverage services, Eating places/restaurants, Schools or daycare centers",2.0,No,No,No,https://drive.google.com/open?id=1mW2QJd2twebwWMjBRz8xAidnrLN8b3zb,"2025 Addison Street, Berkeley, CA, 94704",Berkeley Repertory Theater,https://drive.google.com/open?id=1Umyt2qDpHj94IW_PJjo3BNXnP95kayEv,"2071 Addison Street, Berkeley, CA 94704",Berkeley Repertory Theater School,https://drive.google.com/open?id=10iDSwCSBClC8cYjqZLq-o1ESlA19FAxI,"2072 Addison Street, Berkeley, CA, 94704",Vacant building. Used to be a 24 Hour Fitness. ,https://drive.google.com/open?id=16cmMlA-fSMoESwCLxokro15i9n59_HGr,Freight and Salvage ,"2020 Addison Street, Berkeley, CA, 94704",https://drive.google.com/open?id=1lNTksUVAXd7mpDzRNJucEnNf0Op1-x6g,"2025 Center Street, Berkeley, CA, 94704",Center Street Parking Garage. Has entrances/exits on Addison street side as well.,"[37.8715459028069, -122.268438100878]","[37.871164, -122.2691109]","[37.8709715, -122.2689098]","[37.8708818, -122.2695335]","[37.8701445790056, -122.269894294884]"
10/30/2019 18:17:12,4214.0,1.0,2.0,1.0,2.0,0.0,2.0,1.0,No,2.0,Yes,Parks,3.0,Yes,No,No,https://drive.google.com/open?id=1DErTFFKXTE8BBxnNEbNx0r4tMgXScz_U,"1100 Sutter St, Berkeley, CA, 94707",,https://drive.google.com/open?id=1-XK6SrEu759NFWh589hLa1yj6c93g920,"1000 Sutter St., Berkeley, CA, 94707",,https://drive.google.com/open?id=1eeeWgA3VFB3Bj0HT8vGRQ0tLeJYX_zuK,"950 Sutter St, Berkeley, CA, 94704",,https://drive.google.com/open?id=1xaplMuQ32Vkan9lhOKNnEQlOKFAr9xZQ,,"900 Sutter St, Berkeley, CA, 94707",,,,"[37.8880663, -122.2725301]","[37.8886648, -122.2723899]","[37.8886648, -122.2723899]","[37.8886648, -122.2723899]",
10/30/2019 18:24:21,4201.0,1.0,1.0,1.0,1.0,0.0,3.0,1.0,No,1.0,Yes,"Parks, Playgrounds, Schools or daycare centers",3.0,No,No,Yes,https://drive.google.com/open?id=1QLFn0T3lesQinve6gGw9vg1wE6XpTu3_,"1325 Portland Ave, Albany, CA, 94706","Playground structure at Memorial Park in Albany, CA. Two separate playground structures were present, one for younger children and another for older children. Parents were present with their children, no other individuals were seen nearby.",https://drive.google.com/open?id=16Pvwtsk5sXCMwMNI2Ldxxysu76P6I3D7,"1325 Portland Ave, Albany, CA, 94706","Community garden at Memorial Park in Albany, CA. One of the various recreational resources observed within the block. ",https://drive.google.com/open?id=1xq1dVYvAF7wxGs0q26Pg4QPeTCyGhxcq,"1325 Portland Ave, Albany, CA, 94706","Barbecue pits/ picnic area at Memorial Park. The area was very clean and was empty. The only individuals in the park were families, homeless people were not seen nearby. ",https://drive.google.com/open?id=1bWJ1OLVMV21PoWLGhYNayYN8D0yd87BI,"Albany Aquatic Center, right next to Memorial Park. ","1311 Portland Ave, Albany, CA, 94706",https://drive.google.com/open?id=1pCZSaMJTov2HMuNZcL5EOljoOkNdBzuj,"603 Key Route Blvd, Albany, CA, 94706 ","Albany High School, the campus wasn't fenced in. The area was very quiet, however there were a lot of cars parked on the street. ","[37.89559215, -122.290822536266]","[37.89559215, -122.290822536266]","[37.89559215, -122.290822536266]","[37.8949383583722, -122.292130577447]","[37.8965494259009, -122.29256332415]"
10/30/2019 19:27:14,4030.0,1.0,2.0,1.0,1.0,0.0,3.0,2.0,Yes,2.0,No,"Bars and alcoholic beverage services, Bodega deli corner-store convenience store, Eating places/restaurants, Fast food or take-out places, Liquor stores or Marijuana Dispensaries, Payday lenders check cashers or pawn shops, Supermarkets/grocery stores",1.0,No,No,Yes,https://drive.google.com/open?id=1HX1P2Io06ha95eFPFyLPDunu8EJx8c-I,"388 9th Street Suite #159, Oakland, CA, 94607","The intersection between 9th Street and Franklin Street. There is a homeless man walking diagonally across the street, despite the incoming traffic.",https://drive.google.com/open?id=1UFcHI_RO2lhfVVITNwct4V3XPeTyIreB,"388 9th, Oakland, CA, 94607","This is the entrance to the plaza. The building is not fully enclosed, as you can see the sunlight shining in the back. ",https://drive.google.com/open?id=1hRzTrz9CYwpQl7nlYKmLVParFbJRaWS3,"371 9th St, Oakland, CA, 94607","This is a picture taken of the opposite side of the block, from the plaza. Wahing Chinese Products is a variety store that holds household goods and other knick knacks.",,,,,,,"(37.8004265, -122.270732)","(37.8004265, -122.270732)","[37.8000770246076, -122.271541671819]",,
10/30/2019 19:45:25,4239.01,1.0,1.0,1.0,3.0,0.0,3.0,2.0,Yes,2.0,No,,3.0,Yes,No,No,https://drive.google.com/open?id=1oxJpFxvQUVoxZYdKyd7suIEUxB_12qRA,"2000 Woolsey St Berkeley, CA, 94703",An outstanding truck with graffiti parked on the street.,https://drive.google.com/open?id=1j066Zz7F_JgDxd5Gg43X0JnA3cp1mq2M,"2014 Woolsey St, Berkeley, CA, 94703","A house with Halloween decoration, looks beautiful.",https://drive.google.com/open?id=1g6q8lQqOlUDelbIlIl0ymIylxmzLkrYf,"2024 Woolsey St, Berkeley, CA, 94703","Ground carving, two terms which are “smile” and “open yourself”",,,,,,,"[37.852082, -122.267853]","[37.8521387388844, -122.267404099289]","[37.8522025365829, -122.266936336603]",,
10/30/2019 20:47:03,4239.01,1.0,2.0,1.0,2.0,0.0,3.0,2.0,Yes,2.0,No,,2.0,No,No,No,https://drive.google.com/open?id=1nGft8JQXJnjP0rdbUgByl4qjP11z8fch,"2218 Prince Street, Berkeley, CA, 94705",The picture shows the block face of Prince St. You can see there are parked cars on the street. There are also trees lining the street.,https://drive.google.com/open?id=1qfRLNIWlH4Kp104-fmXe6AADRMh601SD,"2215 Prince Street, Berkeley, CA, 94705","The picture shows the only building that was not residential on the street (Chochmat HaLev, Center for Jewish Spirituality).",https://drive.google.com/open?id=1vdZgzzZLEIdFLp329spgt7FoVMxjiN_f,"2204 Prince Street, Berkeley, CA, 94705",The picture shows the only house (the white house) that seemed to have bars on the window.,https://drive.google.com/open?id=1w0gQvSqzNBSL2u8u-1nj5KRcYrRPUyCL,The picture shows the apartment building on the street that appeared to 4-6 units.,"2204 Prince Street, Berkeley, CA, 94705",https://drive.google.com/open?id=14LMNL2PzKZZvX9lDS0mQgwKM6r1XUq8d,"3051 Wheeler Street, Berkeley, CA, 94705",The picture shows what the street looks like when standing on the corner of Prince St. and Wheeler St. ,"[37.853399737639, -122.263319984338]","[37.85367925, -122.263533724072]","[37.853334477885, -122.263838758079]","[37.853334477885, -122.263838758079]","[37.8538692442075, -122.264163775352]"
10/30/2019 21:28:02,4028.0,1.0,1.0,1.0,4.0,0.0,3.0,3.0,Yes,3.0,Yes,"Professional offices (doctor dentist lawyer accountant real estate), Warehouses",2.0,Yes,No,No,https://drive.google.com/open?id=1WWUODGHGV7wVQjm1NmsEqEgqufJCv1Oe,"1919 Martin Luther King Jr Way Oakland, CA, 94612","As seen on the black fence posts, there is some graffiti around the block. However, there does not seem to have been any efforts to cover or get rid of the graffiti. ",https://drive.google.com/open?id=1sninhJlbvsnaDvy1GtC5liNYRTJqvV1I,"1905 Martin Luther King Jr Way, Oakland, CA, 94612","Next to the apartment complex, there is an open space for a parking lot. The emptiness of the lot seems out of place in comparison to the block which is tightly packed with houses and buildings. ",https://drive.google.com/open?id=1ZHV_fvdRQ5NEOlPGx2Qfu9KQdJqQK0T0,"670 19th Street, Oakland, CA, 94612",The houses are very similar in shape and very narrow. The color differentiates them from one another. ,https://drive.google.com/open?id=1U8fYyHRiDnPbAuuvzwKCX3I0TysROkni,"A sidewalk sign has been blown over by the wind and collapsed. There is another one in front of it that lies right in the middle of the sidewalk, blocking pedestrians. ","670 19th Street, Oakland, CA, 94612",https://drive.google.com/open?id=19jCjS4PgLNaZIEhEyldkIA99vhTlFjJn,"689 Thomas L Berkley Way, Oakland, CA, 94612",This building looks like it has been abandoned because of the paint on the windows and the wood blockings in the back. It gives off an eerie vibe as there is no sign or indication of what the building is supposed to be. ,"(37.8087183, -122.2715003)","(37.8087183, -122.2715003)","[37.8097388650208, -122.274274379911]","[37.8097388650208, -122.274274379911]","[37.8085879, -122.2668561]"
10/30/2019 21:32:01,4007.0,1.0,1.0,1.0,2.0,0.0,1.0,1.0,Yes,1.0,Yes,,1.0,No,No,No,https://drive.google.com/open?id=1hDjuQGwNylIzQUNSKa_M-kKAvSkxeHH8,"841 Aileen St, Oakland, CA, 94608",This is one of the more extensive houses on the street; it has the appearance of being more modern. ,https://drive.google.com/open?id=12-4OapQXkKKYUc9JmH8Qk0sSzJCZCRv_,"836 Aileen St, Oakland, CA, 94608","This is one of the less extensive houses on the street; it does not have the appearance of being as modern. I found this house interesting as it was the only one that was enclosed in this manner.
",https://drive.google.com/open?id=1hFQNIa7gcY2eyZL20TB85S9_AU9yc3Xc,"816 Aileen St, Oakland, CA, 94608","This is one of the smaller houses on the street; it has the appearance of being there for at least a few decades. Additionally, this house is interesting because of the ATM machine in the front yard.",https://drive.google.com/open?id=1ta0A3CMwVp0688LN-4YxWfNigVVjNpQJ,This is one of two Neighborhood Watch signs on the street; it appears that someone purposely spray-painted over the contact information for local authorities. It reads “. . .immediately report any suspicious activities to the. . .” then the bottom text is obscured by the black spray paint.,,https://drive.google.com/open?id=1KXgLVsAXHETb56i3MVXHkSq7X3uoXIlW,,A friendly neighborhood cat trusted me enough to follow me around the street. I find that this provides insight into the safety of the neighborhood; this cat was the only animal I saw on Aileen St.,"[37.8411076152393, -122.271693192776]","[37.8412883498779, -122.271568234798]","[37.8413587393546, -122.270935271339]","(37.8417578, -122.2723135)","(37.8417578, -122.2723135)"
10/30/2019 21:40:15,4224.0,1.0,1.0,1.0,2.0,0.0,3.0,1.0,Yes,2.0,No,"Auto repair/auto body shop, Community center, Eating places/restaurants",2.0,No,No,No,https://drive.google.com/open?id=1uT15_g_SOEX2CJPwiTNyNhWHSvcmnjGS,"1784 Shattuck Avenue, Berkeley, CA, 94709","Photo 1: At one point, a man set these bags down on the sidewalk for several minutes while inside of Sam’s Cleaners. Eventually, he seemed to be cleaning the inside of the establishment; and the bags most likely contained cleaning-related supplies (one seemed to be full of shredded paper). However, it was unusual that the person left the items outside while discussing something with the owner rather than simply entering and starting a shift.",https://drive.google.com/open?id=1s-6dc5yMwNoCdFpqGp6F73v9QVDfHTBK,"1788 Shattuck Avenue, Berkeley, CA, 94709","A few establishments provided benches for use. As can be identified in the photo, benches were fairly short, with built-in metal armrests; this was potentially to prevent use by homeless people. However, there was no apparent deterrent for members of the general public who wanted to use the bench.",https://drive.google.com/open?id=1yZYuqD1_R_81xLL5XaG9YA-M40ifB0gM,"1798 Shattuck Avenue, Berkeley, CA, 94709","This establishment (Boba Panda) was closed, with brown paper covering windows from the inside. Due to window reflections, it is difficult to see, but there is a sign above the white art gallery sign which states “Temporary Closed Sorry” (each word on a separate line).",https://drive.google.com/open?id=1azBuLaZr5E3-7GRgjjec3gG-8Al6_MwZ,"The block face contained the art gallery shown above, noted because in the observer’s experience, art galleries are not frequently stumbled across. Additionally, this was a characteristic storefront size for all establishments on the block face, and similar to the gallery, none of the other establishments seemed to be commercial chains.","1790 Shattuck Avenue, Berkeley, CA, 94709",,,,"[37.8751117, -122.2689092]","[37.8750524, -122.2689024]","[37.8748817, -122.2688807]","[37.8749856, -122.2688943]",
10/30/2019 21:45:16,4203.0,1.0,1.0,1.0,1.0,0.0,2.0,1.0,No,1.0,No,"Banks or credit unions, Bars and alcoholic beverage services, Eating places/restaurants, Fast food or take-out places, Liquor stores or Marijuana Dispensaries, Professional offices (doctor dentist lawyer accountant real estate), Supermarkets/grocery stores",2.0,Yes,No,No,https://drive.google.com/open?id=1dWlZTt0HCIrVE0lklPU2aD30DIhbVMTM,"823 San Pablo Ave, Albany, CA, 94706",The cars parked in the area are mid-range/older models suggesting a middle class income,https://drive.google.com/open?id=1f1xoq5Y9FhFeS4NTJk4GwlRGfHxKH8Mk,"811 San Pablo Ave, Albany, CA, 94706","The only dirt on the road was due to the high wind, which means the roads are cleaned daily.",https://drive.google.com/open?id=1r5pRBFg-g23vOJnz5oRKZO-IKJ80QAAU,"835 San Pablo Ave, Albany, CA, 94706",Florists and organic bedding shops suggest the visitors have the capital to spend on extraneous items for personal satisfaction,,,,,,,"[37.8915539241956, -122.299570889933]","[37.8919446428571, -122.299699214286]","[37.8908851, -122.29880533497]",,
10/30/2019 22:48:42,4212.0,1.0,1.0,1.0,1.0,0.0,1.0,2.0,No,2.0,No,Parks,3.0,Yes,No,No,https://drive.google.com/open?id=1O-UiMnUwalid7iBsadFl0icC9SjQ0Y5F,"950 Indian Rock Ave, Berkeley, CA, 94704",Indian Rock Park,https://drive.google.com/open?id=1PxJMZoW7IZ3lkE7vQuraDYhV24cMdZM5,"830 Shattuck Ave, Berkeley, CA, 94704","Narrow, windy streets with lots of parked cars",https://drive.google.com/open?id=1V0FUxgXnsrYzFENNmkbvxMZqj-luuIRy,"800 Shattuck Ave, Berkeley, CA, 94704","Large houses with front yards, trees line the block",,,,,,,"[37.8916923904616, -122.272464651364]","[37.8724895, -122.2684359]","[37.8724895, -122.2684359]",,
10/30/2019 23:15:48,4205.0,2.0,1.0,1.0,2.0,0.0,1.0,2.0,No,1.0,No,"Banks or credit unions, Bodega deli corner-store convenience store, Community center, Eating places/restaurants, Playgrounds, Professional offices (doctor dentist lawyer accountant real estate), Schools or daycare centers",2.0,Yes,No,No,https://drive.google.com/open?id=1gERqal-K7HQj_OA9tpfsfUHqqGRxXYfe,"1175 Solano Ave Albany, CA, 94706","This place looks like it's brand new or has just been sold, not a lot of movement happening",https://drive.google.com/open?id=1CvFgBNWlS4f-LrR8fPKDQeRSR-4fArle,"1158 Solano Ave, Albany, CA, 94706",A local restaurant,https://drive.google.com/open?id=1qmEuUpAtbk1yfMH5-8ilnQ-1hGy--xch,"1187 Solano Ave, Albany, CA, 94706",Parking on the face of the block,https://drive.google.com/open?id=1Gx6FOmosXWMgDns0oHtLBRNMgvXMe1yF,Cornell Elementary School,"1200 Solano Ave, Albany, CA, 94706 ",,,,"[37.8905115, -122.2970234]","[37.890272, -122.297287]","[37.890469725359, -122.296602435881]","[37.890332, -122.296098]",
10/30/2019 23:32:47,4202.0,1.0,1.0,1.0,1.0,0.0,3.0,4.0,No,2.0,No,,2.0,No,No,No,https://drive.google.com/open?id=18fesAZN6wkE9nkFE_QvsbIL_rBcfPxLo,"623 Cornell Avenue, Albany, CA, 94706","These two adjacent homes highlight the diversity of the houses on Cornell Avenue.
",https://drive.google.com/open?id=126BytfRQuQX_L5W5tNFB9uQqTBufw4D2,"614 Cornell Avenue, Albany, CA, 94706","This home is a prime example of how unique the houses are. A handful of the homes have fences or walls, but this one is the most sophisticated.",https://drive.google.com/open?id=1cy6DcU4CjwMM_D-nPGCACSA1YMgAT6xz,"630 Cornell Avenue, Albany, CA, 94706",This woman was the only person I saw. She treated me with suspicion and took it upon herself to photograph me.,https://drive.google.com/open?id=17vKyvcIiPXzz9_YKzN4viI2CoK6nfF__,"
There was a child’s toy on the street. It is unclear if it was left out to be picked up as trash or if it was simply forgotten outside.","1011 Martin Luther King Jr Way, Oakland, CA, 94607",,,,"[37.895173871529, -122.297684685644]","[37.8952473002517, -122.297922268039]","[37.8950204165002, -122.297851071437]","(37.8944611, -122.2974624)",
10/31/2019 0:33:54,4206.0,1.0,1.0,1.0,2.0,0.0,3.0,1.0,No,1.0,No,Professional offices (doctor dentist lawyer accountant real estate),2.0,No,No,No,https://drive.google.com/open?id=1ovUGngua4n3oNFaqa3vhB6PnzMJe63gT,"940 Pomona Ave, Albany, CA, 94706","The sidewalk on this block face had cracks and broken pieces, as seen in the picture. It would be easy for someone to trip and fall if they did not watch where they walked.",https://drive.google.com/open?id=1qM7KksD5SnBDsmmG4oBD41PrkbVPUniB,"1032 Pomona Ave, Albany, CA, 94706","This house was recently sold, which shows that people would want to live in this neighborhood; the houses are well-kept, the streets are clean, and the overall neighborhood is quiet. ",https://drive.google.com/open?id=1VNLiR-4FHtniYYHY5L7mUmav6k4NYJPN,"918 Pomona Ave, Albany, CA, 94706","This house, like many others on the street, has Halloween decorations, which indicates that the residents on this block face are spirited and participate in American traditions. These decorations also made the neighborhood feel more homely. ",https://drive.google.com/open?id=1uoursZN2X6lHi46kufBT2RBQfl0pZkVV,"The front yard of this house has not been maintained, as the grass is untrimmed, there are dry patches everywhere, and fallen leaves have not been cleaned up. Most of the front yards are like this, which is odd because the houses themselves seem clean and well-kept. ","932 Pomona Ave, Albany, CA, 94706",,,,"[37.8895228065193, -122.291656369316]","[37.8870126577985, -122.29086868448]","[37.8900411700676, -122.291820625765]","[37.8897113023551, -122.291716098934]",
10/31/2019 8:22:11,4028.0,1.0,2.0,1.0,2.0,0.0,1.0,1.0,Yes,2.0,No,"Eating places/restaurants, Professional offices (doctor dentist lawyer accountant real estate)",1.0,No,No,No,https://drive.google.com/open?id=1mWQORRnd-YiMwZq-iD7xavvgkJJi0_eW,"1951 Telegraph Ave Oakland, CA, 94612",Side walk is under construction. The building across the street (Beauty Supply) has graffiti. It is the only graffiti visible on the block. Image is taken infront of modern coffee/art store.,https://drive.google.com/open?id=1QBxiW9Y3GWHK3LVagSuRaMOoSQ8Jnwz2,"520 20th St, Oakland, CA, 94612",Modern and up-kept apartments. The building with the arch is a climbing gym.,https://drive.google.com/open?id=1NgXYsB8sLRAIy6paG6PR0h_PHHNr7jGw,"576 20th St, Oakland, CA, 94612","Clean, quiet, metered street. Many hybrid cars. ",https://drive.google.com/open?id=19oKkqiQjTWKGw54VToZTMR83BO9AA2iJ,There is an SEIU (a union) office. Note the ride-share electric scooter parked out front. ,"560 Thomas L Berkley Way, Oakland, CA, 93612",,,,"[37.8092978, -122.2698631]","[37.8098937, -122.2701276]","[37.8100013279443, -122.271594007969]","[37.8099408213802, -122.271212989491]",
