1,2.0,1.0,1.0,1.0,1.0,1.0,2.0,2.0,"My thoughts about this image was that the city made considerable efforts to maintain biking lanes and upkeep traffic control in regards to these lanes. This makes me think that the city puts an emphasis on more ecological means of transportation. They city is also likely able to do this because they have the funds for it, and considering that there are several markets, schools, and convenience stores in this residential area, everything residence need is within biking distance, which is probably why the city (as well as its residents who are involved in city management and likely want to use/advocate for these biking lanes) cares to even do this. Unfortunately, I do not see this often in poorer communities. ","In terms of image 2, we see this street sign is not like any other. It is made from stone with the street name engraved at the top under a statue of a sphere. This work of art, especially just for a street sign, is not common among impoverished neighborhoods, where street signs may not even be present. This street sign is symbolic of the wealth of the city and its citizens, denoting that they have the capital to build such an aesthetic monument for such an ""average"" object.  ","Across the street is a gas station, near the hub of the city. Unless most other gas stations in impoverished neighborhoods, this gas station is very well kept, not always super busy, and has seen some renovations in the past (I know because I used to stop there when I was younger). The business is obviously investing money into this specific station, likely to please their affluent customers/maintain the image of the area. The price of gas is fairly high. ","Next to the Public Library, there is a park consisting of a big grass field and trees. The area looks very well maintained (Thick bright green grass and green flourishing trees) as apposed to parks I have seen in the inner city that are mostly dirt and dark green weeds. I saw many children who seemed to be a part of the after school program playing in the park with some adults. I could tell the staff and volunteers are very involved in the programs, and that the library is thriving. The park, as well as the surrounding area, was clean of all trash, even loose leaves. ","One of the biggest observations to be made was of the housing. The houses were significantly well kept, in terms of the house itself and the gardening/driveways. These houses probably go for $700,000 and up. You could tell it was a wealthy community. I didn't see much people, but the area was only somewhat diverse. ",2018-10-23 14:50:52,"Bodega deli corner-store convenience store, Fire station, Gas station, Parks, Public library, Schools or daycare centers",4213.0
1,3.0,1.0,1.0,1.0,1.0,2.0,2.0,4.0,The construction unfortunately makes this block appear worse in quality that in reality. The sidewalk is blocked and the huge container both make the pedestrian experience disappointing.,I really appreciate the beautification efforts with the lights on these trees. It makes the place feel nicer.,This bank is very fortified. The entrance has a huge metal gate. It feels like a castle or a fortress of some sort. It was really awesome but also was indicative of serious levels of crime in the area.,At first I just thought this was a random pile of trash. I then realized that it was a pile of bags containing recyclables. Then I realized there was someone sleeping in the middle of it! That was the only homeless person I saw on the block.,,2018-10-23 14:59:13,"Banks or credit unions, Bars and alcoholic beverage services, Eating places/restaurants",4229.0
1,2.0,3.0,4.0,1.0,1.0,2.0,2.0,4.0,"There were many cars parked on the block face but interestingly I did not see anyone walking on the street. I also found some cigarette butts, but I would say the street was relatively clean compared to other areas in Berkeley I have seen.","This picture is taken on one side of the block face, where there are business stores including a restaurant, clothing stores, digital printing service shop, etc. I noticed that there were only few people entering these stores while I was observing there, and the block face was really quiet overall. ","I noticed by walking into this street from the block face that has business stores, there were marijuana joint butts on the street but not on the street with business stores. Also, I saw some adults walking but not children on the street. ","The picture of Trump on the wall got my attention, so I was observing the area and people inside the house having a conversation. I noticed that they talked about politics and a very biased topic toward certain groups of people. ",,2018-10-23 15:15:07,Eating places/restaurants,4213.0
1,2.0,1.0,1.0,1.0,1.0,1.0,3.0,2.0, Clean and light Traffic,Nice environment grass are green and fresh no trash on the side of street.,Parking area all cars nicely parked ,Garbage place doesn’t smell and overall looks clean! ,Bus stop for public transportation and also lost of parking spaces for residents and visitors,2018-10-23 15:27:46,"Community center, Eating places/restaurants, Playgrounds",4202.0
1,1.0,1.0,1.0,1.0,1.0,1.0,3.0,2.0,"People at Cesar on Sunday afternoon. This area is well known as Gourmet Ghetto, filled with fine restaurants","A café on Walnut St, the opposite side of Shattuck Ave. People look very relaxing and enjoying the sunny weather.",Walnut street is composed with residential area providing stable and peaceful environment.,"ery well-shaped small gardens, different environment from the opposite of the block: Shattuck Ave",,2018-10-23 17:34:16,"Bars and alcoholic beverage services, Chain retail stores, Eating places/restaurants, Post office, Professional offices (doctor dentist lawyer accountant real estate)",4217.0
0,3.0,2.0,1.0,1.0,1.0,3.0,2.0,3.0,The paint on the house seems have peeled off. All the windows are closed and the garden was not taken care of. I assume it is an vacant house. ,"This is a broken car with no license plate, I assume it is abandoned. ",This is a 3 story apartment with parking space on its first floor. ,There are graffiti on the garbage bin and it is over filled. ,The church stands out from the average residential block. ,2018-10-23 18:08:22,,4027.0
1,2.0,1.0,2.0,1.0,1.0,1.0,1.0,3.0,It would be easy to write a graffiti in the area because there were only a few people even during daytime.,I could see that people tend to speed up around the area because the view is open.,This was the only construction site I saw. I presume that there are not many newly made houses there.,,,2018-10-23 18:33:52,,4010.0
0,1.0,2.0,1.0,2.0,2.0,2.0,3.0,5.0,Apartment Building #1,Apartment Building #2 ,Apartment Building #3 ,Neighborhood Watch,Car ,2018-10-23 19:53:32,,4005.0
0,1.0,2.0,1.0,1.0,1.0,2.0,3.0,3.0,Image of a house on the block with a young white couple walking in front of it,Image of a house on the block which is getting remodeled,Image of a house with an electric ramp for wheelchairs,"590 63rd street, Oakland, CA, 94609",,2018-10-23 20:00:48,,4005.0
1,2.0,1.0,1.0,1.0,1.0,1.0,3.0,1.0,An image advertising a read-a-thon at the elementary school,"A home decorated for halloween, indicative of a family oriented neighborhood ",One of the few homes on the street that had a gate. ,The west side of the street did not have sidewalks or they were very narrow. ,,2018-10-23 20:19:22,"Parks, Schools or daycare centers",4212.0
0,1.0,2.0,2.0,1.0,2.0,2.0,3.0,3.0,"A rather out of place building with “no parking” signs all along the garage, yet cars parked directly in front of it.",The residential housing which seems rather well maintained.,"A very small amount of litter present in the curb, but the sidewalks are clean. ",Roads in fair condition and trees growing on both sides of the road.,An apartment complex that seems to house around 10 people. ,2018-10-23 20:27:26,,4027.0
0,3.0,2.0,3.0,1.0,2.0,2.0,2.0,2.0,"The street is filled with contrasts. Both old and new, well kept and not kept up at all. This image captures the occasional garbage on the road, but also small gardens that are maintained. Present in the picture is also a garbage can for organic waste, and as I walked past what appeared to be the owner of the house talked to the hired gardener. A street with litter, but some bushes perfectly cut. ","While the street was mostly quite clean, there were some empty vodka bottles. Not particularly good vodka either if you ask me. ",A lot of construction/rehabilitation of apartment buildings went on in the street.,"Some apartment buildings appeared very new, contrasting the more worn out ones with partial paint jobs and rusty fences. ",The building facing the modern apartment building. It houses a religious community.,2018-10-23 20:33:02,Professional offices (doctor dentist lawyer accountant real estate),4010.0
0,2.0,2.0,3.0,1.0,1.0,2.0,1.0,3.0,This picture is of the apartment complex on the street. It looked white new and was also the only place on the block were trees were observed. They’re quite a variety of tree heights.,"The picture is of the end of the apartment complex and a sign that says directs the public to a cafe within a small alleyway beside the building. The fence was the area I saw the most tagging and graffiti on. This picture specifically shows multiple stickers on the pole of the fence.
","This picture is of the other building on the street that was an art institute. It looked closed for the day and pretty empty. It was not in as good of a condition as the apartment complex was.
","This picture is of the large, open parking lot on the street. I believe it was public parking and that there was some sort of fee for using it.",,2018-10-23 20:39:12,Eating places/restaurants,4028.0
0,2.0,2.0,3.0,1.0,2.0,3.0,2.0,5.0,"“Justice for Mike Brown” and “Justice for Eric Garner” posters hanging on the windows to demonstrate support for the injustices the community have faced in Oakland.
","An empty liquor bottle of E&J lying on the curb in Oakland. This was the only liquor bottle that was on the ground.
","One of the views of the street. Along this street, we can see houses, cars, “no parking” signs, trees, and “Black lives matter” posters.
",,,2018-10-23 20:42:19,,4010.0
0,2.0,1.0,1.0,1.0,1.0,1.0,3.0,1.0,Some abandoned stuff plus a rental bike on the sidewalk.,Clean street with school in the background connected to the park.,Dry grass with mesh fencing around one yard and some graffiti on a stop sign.,Political sign on dry grass and graffiti on a stop sign on an otherwise clean street.,,2018-10-23 20:42:58,"Community center, Playgrounds, Schools or daycare centers",4201.0
0,2.0,2.0,1.0,1.0,1.0,1.0,3.0,2.0,House (among others) with Peggy McQuaid campaign yard sign.  ,Children playing at Marin Elementary during what is presumably recess.,A sidewalk rehab sign on the side of the street. ,A relatively large two-story house on the corner of the block. ,,2018-10-23 20:54:32,Schools or daycare centers,4206.0
0,3.0,2.0,2.0,1.0,1.0,4.0,2.0,5.0,This was the only modern/nice house (to me) on the block which made it stand out a lot. ,"This board was interesting because you don't usually see things like this in neighborhoods. I thought it was cool that people living around here are able to post flyers about different things. This is a good way to announce things, but could also be bad because it could mean that these people don't talk or spread news in person. ","I chose to take a picture of this house because through the windows (although you may not be able to see in the picture) looked looked like there wasn't much in there. It didn't look abandoned, but also not like there is every day life in there. Also, the back yard of this house look boarded up. ","This park was directly behind the street I chose to observe. This park unlike the street, was full of homeless men. Most of which were African American and on Delaware there were only old white folks. ",,2018-10-23 21:11:05,Parks,4224.0
0,1.0,1.0,1.0,1.0,1.0,1.0,3.0,2.0,,,,,,2018-10-23 21:13:32,"Bodega deli corner-store convenience store, Eating places/restaurants",4202.0
0,4.0,2.0,1.0,1.0,1.0,3.0,1.0,3.0,This house is one of the diverse homes in block and is one of the decent looking homes in contrast to the rest. However there were a few other homes that were slightly in better condition but did not represent the neighborhood well.,This is part of the fence to the school and playground. The fence is spiked at the top and is well over ten feet high with an old sock hanging between the bars. Most of the homes have fences over six feet in height. ,Graffiti on a parked commercial truck. This truck possibly is parked without a proper permit. ,"
825 Brockhurst St. Emeryville,CA 94608
","
825 Brockhurst St. Emeryville,CA 94608
",2018-10-23 21:18:34,"Liquor stores or Marijuana Dispensaries, Playgrounds",4014.0
1,1.0,3.0,3.0,1.0,1.0,4.0,3.0,2.0,"The first store you can see in this image is a liquor store on the San Pablo Ave. Overall, San Pablo Ave is fairly clear than any other streets on my block. I was able to find various kinds of people on this Avenue. For example, children with parents, teenagers who're riding skateboard, and college students.","As you can see through the image, there is a theater, cafe and Japanese restaurant. I would like to say this street is mostly dense and I saw many people are hanging out on this street. Also, it is on the Solano Ave which tended to be the main street in Albany city.","This is a picture of a parking space on the back side of the Mechanics Bank. The Mechanics Bank is located in the intersection between San Pablo & Washington Ave. The parking lot is located in the intersection between Washington & Kains Ave where I took this picture. However, I was able to find people who were loud enough to hear music in their cars and people who smoke on the Washington and Kains Ave.",This is a picture that shows people who smoke in the Mechanics Bank parking lot.,,2018-10-23 21:32:03,"Banks or credit unions, Bars and alcoholic beverage services, Eating places/restaurants, Liquor stores or Marijuana Dispensaries, Professional offices (doctor dentist lawyer accountant real estate)",4202.0
0,2.0,1.0,1.0,1.0,1.0,2.0,3.0,1.0,"The Toyota dealership did have some sort of censored lighting. This is also the only other establishment located on the block. Also, like the audio business, there isn’t any clear separation between the business and the sidewalk. The back of this dealership is the parking lot for the electronic business. ","One of the two electronic businesses on the block I analyzed, there are no types of physical barriers between the business and the street. Also, the lights were not censored, and were on the entire time. To the left of the business is a large apartment, of roughly 6-8 units. ","We can see plenty of trees that have yet to be trimmed. There is also an apartment complex on the left side. The street is almost completely clean if we discount the leaves and brush. Also, a relatively well-maintained classic VW Beetle.",,,2018-10-23 21:45:10,Auto repair/auto body shop,4235.0
0,1.0,1.0,1.0,1.0,1.0,1.0,3.0,4.0,I thought it was pretty nice that there was a free mini library in front of a house for anyone to leave a book or take a book. ,There was a house that had a political sign out in front showing that there are folks who are politically aware of the local politics. ,This house had Halloween decorations on its window which could indicate that it is a family neighborhood ,,,2018-10-23 23:23:27,"Parks, Playgrounds",4201.0
1,2.0,2.0,3.0,3.0,3.0,2.0,2.0,2.0,,,,,,2018-10-23 21:59:18,"Auto repair/auto body shop, Bodega deli corner-store convenience store, Eating places/restaurants, Liquor stores or Marijuana Dispensaries",4007.0
0,1.0,3.0,4.0,1.0,1.0,4.0,1.0,4.0,Lots of trash gathered along curb of sidewalks.,Many stores left out their trash outside on the sidewalk.,"Reveals some thought, time, and effort has been put in to making the street look nicer.",,,2018-10-23 22:20:02,"Banks or credit unions, Eating places/restaurants, Supermarkets/grocery stores",4030.0
0,2.0,1.0,1.0,1.0,1.0,1.0,3.0,2.0,This images shows a double-floor house with a drive way. There is a orange cone in front of it because there is remodeling happening next to it.,This house shows the residential unit owning two cars. One car is parked on the drive way and the other one is parked on the street.,The two-way road with cars parked on both sides and the trees on the sides.,The freshly painted bike lane on the cross street Marin Ave.,,2018-10-23 22:19:16,Schools or daycare centers,4205.0
1,4.0,2.0,1.0,1.0,1.0,1.0,2.0,1.0,I love how they have the cat made out of wood. It looks like its guarding their house.,"I also love this dog, that is on the other side of the house. ",,,,2018-10-23 22:22:04,"Eating places/restaurants, Fast food or take-out places, Supermarkets/grocery stores",4005.0
0,1.0,1.0,1.0,1.0,1.0,1.0,3.0,2.0,There was construction on a street ahead and you saw the majority of the street lined with signs indicating road work. ,There were very few houses decorated for Halloween so I found it interesting how simple yet cute they decided to decorate. ,"I thought it was an interesting mix of social activism and Halloween decorations with the skeleton hidden in the bushes. Overall, I was impressed with their tact and glad they stood for the rights of everyone. This was taken at the intersection of Neilson St and Terrace St but was facing Neilson St, despite what the address says. ",,,2018-10-23 22:48:00,"Parks, Playgrounds",4206.0
1,2.0,1.0,1.0,1.0,1.0,1.0,2.0,1.0,"Though this only one example. I saw over a dozen Prius hybrids on this one block, indicating this Could be a environmentally aware neighborhood.","Even though this seems to be a fairly affluent neighborhood, the roads still have some erosion and damage.",U,"This neighborhood is definitely liberal leaning, or at ast those are the only ones posting signs. ",,2018-10-23 23:29:08,,4214.0
1,1.0,2.0,2.0,1.0,1.0,2.0,2.0,1.0,"Cars parked on the side of the street on the meter parking area. Since the street is wide, it allows for cars to be parked next to each other instead of behind each other. This allows for more cars. Parking area is full and people usually park there for a while. 
","Wide street allows for small recreational areas with some seats. There can be observed some leaves on the ground as well as some trash, mostly papers. This spot is located next to a street parking area. It is interesting that this little place was not allocated for parking. ","Tree adorned with Christmas lights like most of the trees on this street. I’d be interesting to know since what time of the year the lights were put on the tress. 
","This bike rack is another example of the amenities of this wide street. It is very convenient to have a bike rack on this street since there are many businesses here and a lot of people ride their bakes when going downtown. There were not any bikes there when I was there, but I am sure people secure their bikes there. ",,2018-10-23 22:37:16,"Banks or credit unions, Bars and alcoholic beverage services, Eating places/restaurants, N/A",4229.0
0,3.0,3.0,2.0,1.0,1.0,2.0,3.0,3.0,"Tree tangled in power line
"," Area of block containing abandoned industrial building
","Portion of block consisting of residential buildings
",,,2018-10-23 22:49:13,Auto repair/auto body shop,4235.0
1,2.0,2.0,1.0,1.0,1.0,3.0,1.0,3.0,"Two Home across the street from each other: one looks newly remodeled or recently constructed, while the other seems older and a little rundown. ",Abandoned refrigerator on the sidewalk in front of a house.Do not know if it belongs to the residents of the house which it is in front of.,On the corner of the block was an abandoned building that had graffiti writing all around the perimeter. It seemed as if it had been closed down for a while. ,Found a stray cat eating from two boxes of pizza that were almost completely full. Pizzas were left on the sidewalk. ,Outside of what seemed to be a small apartment complex I found more than 6 full trash cans on the sidewalk. Some seem to have been unable to shut due to level of trash.,2018-10-23 22:55:25,,4014.0
0,2.0,1.0,1.0,1.0,1.0,1.0,3.0,2.0,political message,graffiti sign,political participation,graffitti ,free books. proof of safety,2018-10-23 23:39:25,"Parks, Playgrounds",4212.0
1,2.0,2.0,3.0,1.0,2.0,3.0,2.0,2.0,Car with recently smashed windows,Mural on public library,"American Indian Model Schools building, indication of diverse locality","Trash can, overflowing but not interfering with foot traffic. Likely emptied the previous morning, not on a Sunday morning yet. Maintenance workers on strike perhaps?",,2018-10-23 23:44:07,"Banks or credit unions, Bars and alcoholic beverage services, Bodega deli corner-store convenience store, Community center, Eating places/restaurants, Public library, Post office, Schools or daycare centers, Warehouses",4033.0
1,2.0,2.0,2.0,1.0,1.0,2.0,3.0,3.0,"C.H.O.R.I ( Children’s Hospital Oakland Research institution ) it is a biomedical research institute affiliated with California’s pediatric medical center, whose mission is to research problems that threaten the health of children and educate those who work to solve these problems.","North Oakland Senior Center, it offers a variety of services, social and recreation programs to meet the needs of senior people, such as Travel Program; Special Events: Fundraising Flea Market, Holiday Party, Monthly Birthday Lunch; Dancing; Group Walking Program; Classes: Computer, Exercise, Art, Aerobics, Yoga, Tai Chi; Food Services and so on.",There is a lot of stuff here for toddlers and older infants. That includes the playground equipment but also things like a toy truck and high chairs. There is shade and a flower garden. The stuff is not in the best condition but none of it is dangerous.,,,2018-10-23 23:45:03,"Parks, Playgrounds",4007.0
0,2.0,1.0,1.0,1.0,1.0,2.0,3.0,3.0,"This block is a part of the scenic route of Old Oakland. Beautifully old, upkept architecture lines the block. This block seems out of place compared to the environment around it and seems more geared toward tourists.","These are decorations put up for Dia de Los Muertos which occurs from October 31st to November 2nd. There are Stickers of flowers on the ground as part of the ideology for Dia de los Muertos. This part of Oakland is very close, a mere 4 blocks from China town, so while the other streets have mandarin signs this street does not and is celebrating a Hispanic tradition.","There is a lot of open space for outdoor seating, however, there are only a few tables out. All the stores are expensive and cater to Hipsters with unique shops with a mix of the surrounding area. There is an immigration law firm, a family program building with many clothing shops and bars around. The neighborhood feels almost otherworldly and idealistic in comparison to the surrounding area with its pristine glass, and cleanliness.",,,2018-10-24 00:03:06,"Bars and alcoholic beverage services, Eating places/restaurants, Professional offices (doctor dentist lawyer accountant real estate), Supermarkets/grocery stores",4031.0
1,2.0,3.0,2.0,1.0,2.0,3.0,2.0,3.0,"I really liked seeing this quote on the block.  It really made me feel that the people there really valued the street life there, although it didn’t feel as if there was that much.  This combined with the plentiful amount of neighborhood watch signs made the place feel like a safe place to live.  I was kind of sad when somebody graffied over the name of the person quoted.","The support for the telephone poll was covered in stickers.  Although it could very well have been just one person’s artistic expression, the possibility that it could’ve been a collective effort made me appreciate the subtle yet ever-present spirit of the neighborhood. ","A public notice from the city informing the neighborhood about the renovation of an old house.  The layout and design of the house is posted, along with general notes.","This was one of the may places in which graffiti on it.  I didn’t see any on the houses, but any abandoned places, along electrical boxes and telephone polls generally had graffiti.",,2018-10-24 00:06:50,"Auto repair/auto body shop, Liquor stores or Marijuana Dispensaries",4010.0
1,2.0,2.0,1.0,1.0,1.0,2.0,3.0,1.0,No front yards.,Poorly maintained pavement.,Small amount of visible trash/litter.,Kid-friendly. Visible crossing signs,Rich backyard activity.,2018-10-24 00:07:49,"Playgrounds, Schools or daycare centers",4214.0
1,3.0,2.0,1.0,1.0,1.0,3.0,2.0,3.0,"I did not get a chance to see the other side of this building, which I am assuming is the front side and maybe had better presentability. The side pictured is the side facing Shattuck Ave and it seemed like the graffiti may have been there for some time. ","Although I am not completly sure, it seemed that there might be some units in use perhaps, because of open windows and curtains. The building seemed really old and maybe unkempt.","Such as in this picture, it seemed to me that a lot of the corner intersection in my area were where the garbage seemed more concentrated","There wasn't much action during my time there, but I did notice that for being a car services shop, the area surrounding the fence and inside looked pretty clean ","Although it is not shown very clearly in the photo, the shop was closed during the time I was there and the front was locked off with a metal fence",2018-10-24 09:25:35,"Auto repair/auto body shop, Eating places/restaurants",4006.0
