Is there public transportation available in the block face? ,"On a scale of 1 - 4, where 1 is ""No fencing"" and 4 is ""High mesh fencing with barbed wire or spiked tops"", is there fencing and what kind? (includes all property)","On a scale of 1 - 4, where 1 is ""Very well kept / good condition"" and 4 is ""Poor / badly deteriorated condition"", in general, how would you rate the condition of buildings on the block face? (includes residential buildings, recreational facilities, manufacturing plants, business / industrial headquarters, etc)","On a scale of 1 - 5, where 1 is ""None"" and 5 is ""A Lot"",  how many cigarette or cigar butts or discarded cigarette packages  are on the sidewalk or in the gutters? ","On a scale of 1 - 5, where 1 is ""None"" and 5 is ""A Lot"",  how many condoms are present on the sidewalk, in the gutters, or street of block face? ","On a scale of 1 - 5, where 1 is ""None"" and 5 is ""A Lot"", how many empty beer or liquor bottles are visible in streets, yards, or alleys? ","On a scale of 1 - 5, where 1 is ""None"" and 5 is ""A Lot"", how much garbage, litter, or broken glass in the street or on the sidewalks? ","On a scale of 1-3, where 1 is ""Few or none"" and 3 is a ""Most/all of it"", how many trees are linking the street of the block face? ","On a scale of 1-5 where 1 is ""Friendly Responses / Greetings / Helpful"" and 5 is ""Treated with Suspicion"", How were you regarded by the people in the block face?",Other thoughts or comments for Image #1,Other thoughts or comments for Image #2,Other thoughts or comments for Image #3,Other thoughts or comments for Image #4,Other thoughts or comments for Image #5,Timestamp,What kinds of establishments are there on the block face? Select all that apply.,Census Tract
0,2.0,2.0,3.0,1.0,1.0,3.0,2.0,2.0,I found it interesting because the man was very detailed and looked extremely realistic so it caught my attention. I feel that it emphasizes the importance of firefighters in the city of Oakland. ,"This building was intriguing because the architecture of this building seems old, so it stood out from the rest of the buildings on this block. At first glance, you notice that the sign says that it is a hotel, though when you take a look at the windows, it seems like it has become occupied by permanent residents. ","This picture caught my attention because of the political signs, “Oakland Stands United Against Hate” and “March for Our Lives”
For me personally, signs like these touch my heart because I feel that it is important to stand together in the Bay Area against racism and discrimination, as it has become more evident with the recent political climate. I was born and raised in the Bay Area and it makes me proud when people stand for what is right.  ",,,2018-10-21 22:08:57,"Eating places/restaurants, Professional offices (doctor dentist lawyer accountant real estate)",4028.0
1,2.0,2.0,2.0,1.0,2.0,2.0,2.0,4.0,I found this graffiti on a wall in the parking lot of a residential building.,There is a Ford Bike Station and it is almost full.,This is a house for Cal's track and field team.,"Someone put a sticker saying ""eating animals"" on the stop sign, so it seems like ""STOP EATING ANIMALS.""",There is a Buddhist Temple which shows the diversity of the neighborhood. ,2018-10-21 22:10:14,"Eating places/restaurants, Professional offices (doctor dentist lawyer accountant real estate)",4229.0
1,2.0,2.0,1.0,1.0,1.0,2.0,2.0,4.0,"This art shop looked out of place next to the neighborhood, especially right across from the liquor store. 
","This was the only apparent property that was for sale on the block. It was boarded up on one side with bits of graffiti scribbled over the walls. A door had graffiti on it but was painted over. 
","The side of the block near Shattuck was more dilapidated than the rest of the block and were more likely to have bars on windows.
",,,2018-10-21 22:23:08,Liquor stores or Marijuana Dispensaries,4006.0
1,3.0,2.0,2.0,1.0,3.0,3.0,2.0,3.0,"It seems that the wall was not designed for locals to post signs, but it had become such a place since many signs were attached there.",There were groups of homeless people outside the restaurants whose belongings almost occupied  the street.,"There are No-parking signs on the fence, but several cars were still parked there. Besides, there were many parking spaces in the parking lot nearby.",There is a large graffiti on the wall of the parking lot which was quite conspicuous when we passed by.,The fence and iron gate shows that crimes may happen sometimes?,2018-10-22 00:01:58,"Bars and alcoholic beverage services, Eating places/restaurants, Fast food or take-out places, Liquor stores or Marijuana Dispensaries, Warehouses",4224.0
0,1.0,2.0,3.0,1.0,1.0,3.0,1.0,2.0,"There were a few of these green dumpsters throughout the block. All of them had different ""tagging"" on them. I also thought it was interesting that there was a lot of trash on the curbs of the street, but none of the dumpsters seemed full.","There were some ""pay and display"" parking ticket machines like this on the block. The street parking was also filled up during the time I was there, so it seems that this area experiences a good number of visitors. However, I did see some people park their cars here and then walk away to a different block that seemed to have more bars and fancier-looking storefronts. ","This was one of four buildings that seemed abandoned/empty to me on this block (the one next to this had cardboard covering the windows from the inside). Both had some light ""tagging"" on the windows. This building in particular has a ""for lease"" sign on it. ","I took a picture of this truck because it seemed like someone was using it as storage space for their things. It seems like an old truck, but I'm not sure if I would classify it as ""abandoned"". There was also a lot of cigarette butts on the ground.  ","I was really surprised to find a temple on this block because it wasn't something I was expecting to find in this area. It seems to be a Buddhist temple because I also saw a small shrine to place incense sticks on the sidewalk, across the front doors. There were a few posters with Chinese descriptions on the door as well. Some of the buildings on this street also had signs written in Chinese.   ",2018-10-22 00:08:49,"Bodega deli corner-store convenience store, Eating places/restaurants, Payday lenders check cashers or pawn shops, Supermarkets/grocery stores",4031.0
1,1.0,2.0,1.0,1.0,1.0,3.0,2.0,2.0,View from the corner of Essex and Shattuck,View facing Shattuck Ave,Down Shattuck Ave,Residential house of Shattuck Ave,Shattuck Ave residences,2018-10-22 00:09:49,"Bars and alcoholic beverage services, Professional offices (doctor dentist lawyer accountant real estate)",4239.01
1,4.0,4.0,4.0,2.0,4.0,4.0,2.0,4.0,Run down warehouse with razor wire fencing ,"Run down shed, that was tagged ",Tagged Utility monitor ,Trash on Street ,Political mural painting ,2018-10-22 10:52:35,"Bars and alcoholic beverage services, Bodega deli corner-store convenience store, Liquor stores or Marijuana Dispensaries, Manufacturing, Warehouses",4027.0
1,3.0,3.0,2.0,1.0,1.0,4.0,1.0,3.0,"The current state of the road. The pavement appears dark and recently paved, lane lines and crosswalks are replaced with messy spray paint guidelines.",Tagging on the face of the trashcan. The green face appears to have been covered up before.,The mural on the west Oakland Youth Center.,"A wall leading to a small play area for the youth center. A basketball hoop lays on the other sign, with a no trespassing sign on the wall.","An empty lot sits at the end of the block, surrounded by a fence. Graffiti can be seen in the background, and trash lays on the lawn next to the sidewalk. ",2018-10-22 12:00:25,"Community center, Playgrounds",4014.0
1,2.0,2.0,1.0,1.0,3.0,3.0,2.0,2.0,The skin color in the graffiti was non-whites.  I thought it was due to the majority of population in this area is blacks.,"It was a residential apartment on the liquor store (where the graffiti in Image#1 was on the wall).  The face of the block is right in front of a wide road (Adeline St.), so I could imagine loud noises will bother residents. ","Inside of the block looked more like residential area (and it was clean), but there was no enough grass between the door and the street of the houses. ",,,2018-10-22 12:36:50,"Gas station, Liquor stores or Marijuana Dispensaries",4239.01
0,2.0,2.0,2.0,1.0,1.0,2.0,3.0,2.0,"This is a general picture of the street in the 4239.01 census tract. It is relatively shaded with trees and shrubbery, and has very light traffic. There are mostly just residential houses. ","This is a picture of one of the flyers posted on the street. It depicts an event, and is written in Spanish, possibly showing that the demographic in the area is partially Spanish speaking. It seems family friendly, just like the entire street. ","Although the street is mostly clean and well-kept, there is some loose trash on the sidewalks. Most of it is cigarette butts, bits of paper and bottle caps.","This image shows a playground set in the front yard of a house. This shows that the families on this neighborhood are relatively well-off, and that there are families with young children. ",,2018-10-22 13:49:40,,4239.01
1,2.0,1.0,2.0,1.0,1.0,2.0,2.0,2.0,"This is a renovating multi stories parking garage, which has shown that the need of parking spaces in the area. Other than parking spaces for vehicles, it is not hard to see that this parking building will also provide spaces for bikes. ","An open area located in Shattuck Avenue, right next to the Downtown Berkeley bart station. There are tables and chairs for people to sit and rest. During the time I observed, there are two groups of people using the facility. ",An official ballot drop box placed outside of the Berkeley Civic Centre. This facility has increased the connivence for citizen to vote. ,"A newly renovated entrance to Downtown Berkeley bart station. The entrance has used transparent materials, created a stylish and fancy look, which enhanced the appearance of the city. Other exits or entrances are still haven't renovated. ",,2018-10-22 23:01:24,"Banks or credit unions, Bars and alcoholic beverage services, Community center, Eating places/restaurants, Liquor stores or Marijuana Dispensaries, Public library, Post office, Schools or daycare centers, Supermarkets/grocery stores",4229.0
1,2.0,1.0,2.0,1.0,1.0,1.0,2.0,3.0,In this picture you can see a new apartment building under construction and signs of graffiti on the trash can.,This picture shows a gated parking lot for the residential homes.,Recently developed apartment building as part of a gentrified street.,mental health facility ,A new developed Christian boys apartment building.,2018-10-22 15:17:51,"Community center, Warehouses",4028.0
0,1.0,2.0,2.0,1.0,1.0,1.0,2.0,2.0,Three houses in the middle of the block. Distinct color and style though some consistency in the design. The middle house appears in rougher condition with the old rusted car in the drive way. Another vehicle is covered up next to the car.,Car parked on street for sale.,"Larger parking area in front of white shed that lies between two residential buildings: larger white apartment-like complex (at least 4 units per building), and beige house. Lawns are dried up.",,,2018-10-22 15:25:57,,4203.0
0,2.0,3.0,3.0,1.0,2.0,3.0,2.0,2.0,Caption 1 : This is a campaign advertisement placed by one of the residents of 66th street. It is advocating for the candidate Jovanka Beckles who is a mental health professional in Contra Costa.,"
Caption 2: This was placed outside an empty lot that will soon go through the construction of a building of commercial use, but also includes residential space. ",Caption 3 : This is a babysitting advertisement posted on an electric pole. This shows that families do live in this area. ,"Caption 4: A few of these houses had these security signs, which is a warning to anyone that tries to steal or harm the property.
","Caption 5: This patch of grass contains a variety of items that should probably be in the trash; this ranges from cigarette buds, to clothing items. ",2018-10-22 16:38:09,,4005.0
1,1.0,2.0,2.0,1.0,1.0,2.0,3.0,2.0,"The bus stop on Shattuck Avenue faces a large amount of businesses such as a book store, a nail salon, and restaurants. It is convenient for the inhabitants of this block to have many services at such a close range but also for those who come from neighboring blocks who have access to these services in close proximity to a bus stop. ",The Safeway with bike racks in front indicate that perhaps it is common for many individuals from nearby blocks to grocery shop here. The Safeway in the middle of the block adds a large amount of vehicular and foot traffic to an otherwise calm and quiet block. ,"This image shows two of the very few people of color observed in this block. The man is a private security for Bank of the West, while the women is collecting cans in a shopping cart and asking for spare change. ",,,2018-10-22 16:56:02,Supermarkets/grocery stores,4217.0
0,1.0,2.0,1.0,1.0,1.0,1.0,3.0,5.0,sign of jackson street crossing with washington avenue,a resident was giving their used grill away and had a free to take sign on it,most cars were lined up across the street rather than in their driveways,this is the children's center across the street,this is the abandoned stroller across the street,2018-10-22 16:57:02,Schools or daycare centers,4203.0
0,1.0,1.0,1.0,1.0,1.0,1.0,3.0,5.0,the school was located conveniently in a community that circled around the school. The houses surrounding the school were well kept and it seemed like a great place for an evening stroll for the individuals in the community. The street was clean around the school as well there was no visible litter in the area. ,"Although the school was well kept and the neighborhood, the streets in this area were not greatest. There needs to be an improvement in the streets for aesthetic purposes rather than functionality of it since there were no visible potholes. ","Community Park located in between the neighborhood, this was the location where I got the most stares as I'm sure people were well aware that I was not from there and taking pictures of their community as an outsider was probably off putting for them. ",This was the intersection for Santa Fe and Neilson Street  in between where you approach the neighborhood park. Most of the families the day where out in their front yards doing family activities such as pumpkin carvings ,"Just thought this was fancy for a park to have a sign like this, I'm just thinking about the park back home (I'm from a low income latino community) and our park does not have something as official as this. ",2018-10-22 17:58:19,"Parks, Playgrounds, Schools or daycare centers",4206.0
1,2.0,1.0,2.0,1.0,1.0,2.0,2.0,1.0,The group was that big the whole half hour I was there. Also there's bread on the floor and the floor near the bus stop is wet.,Here's the bread. I found the empty bag of bread right where the group of people were. ,These bilingual signs reoccur all around the block. Makes sense since this is Chinatown. ,"The irony of this is that the block has a nice dispenser for your cigarette butts, yet some fellow decided he was too far away and dropped his cigarette butt right next to this light post. You can see the orange butt on the right side.","This is a bit far from the past area, I did take a walk all around the block and saw this tree with a supporting stick tied to it. The stick itself had some neat stickers that show some of the street art and culture, nice.",2018-10-22 18:55:28,"Banks or credit unions, Community center, Eating places/restaurants, Fast food or take-out places, Schools or daycare centers",4030.0
0,3.0,3.0,2.0,1.0,1.0,2.0,2.0,2.0,"The photo shows a residence with a portable outhouse positioned in the front yard, and a sign to beware of dogs. I did not hear any dogs or any people nearby. The house may be under construction, but I conducted my observation on a Sunday and there were no workers to be seen. I was unable to ascertain if the building was abandoned or only undergoing renovations. It may be worth noting that when I went to match my photo with a street address on Google Earth, the image shown on the latter depicted that this house was once in much better repair.","This photo shows what was probably a multiple family residence, surrounded on all sides by high, vision-blocking fencing. At first glance, I assumed from the fencing the building was abandoned, but when I looked closer, I saw lights on and a campaign sign in the window. Flowers grew behind the fence, and the yard appeared to be somewhat maintained. It may be worth noting that when I returned to google earth to match my images to their addresses that the fence was not shown.","This photo is of the street corner directly outside of the house pictured in image 2, showing the large waste items left on the corner. There are a few large items of furniture, denoting the possibility of recent moving or vacating of the residences nearby. ","This is a screenshot from the video footage of the walk taken down Genoa. I was struck by the severe disrepair of the front landscaping for the house pictured, versus the house next door, which was well-kept and decorated for Halloween. Again, the recurring juxtaposition of well kept homes existing directly next to severely dilapidated ones was striking. ","While not on the blockface observed, I photograhed the adjacent corner to show that businesses are nearby, even if not on the blockface of Genoa. This picture was taken from the corner of Genoa and 55th, and shows Clean Cuts Barber, a pedestrian, and the street sign.",2018-10-22 19:05:25,,4007.0
0,3.0,3.0,2.0,1.0,2.0,3.0,3.0,3.0,The painting on the staircase has been peeling off.,"The bars on the lower window indicates how the neighborhood is not entirely safe and how break-ins can occur through the windows, hence some of the houses barred their windows for precaution. ","It appears like someone has cut into the fence, and it hasn’t been repaired since then.","One of many “Cat Brooks for Oakland Mayor” signs
Cat Brooks is running for Oakland Mayor and some of her platform includes fighting for housing for everyone, quality education for everyone, an economy that will create good paying jobs close to Oaklanders, and investing in Early Childhood Development Programs to create safer communities. ",,2018-10-22 20:02:54,,4027.0
0,1.0,1.0,1.0,1.0,1.0,1.0,3.0,2.0,Its the nicest house on the block,Large very old shade tree ,The only quadplex on the block ,,,2018-10-22 20:42:07,Parks,4204.0
1,1.0,3.0,1.0,1.0,1.0,1.0,2.0,3.0,Under construction with fencing lining the area.  Possible abandoned cars in the lot,Homeless pair of people camped out in a tent on the sidewalk of Derby st. ,Construction occurring in front of the block.,A bus passing by in front of the block. This picture was taken from the bus stop for bus 18 and 800 located on the block.,A view of the left side of the block (Derby street).,2018-10-22 21:09:02,Chain retail stores,4235.0
1,2.0,2.0,2.0,1.0,2.0,2.0,2.0,3.0,The houses in this block are mostly well kept. And the bus stop is near although there is only the #12 bus.,"Although the block seems to be peaceful and safe, we can find lots of iron meshes on the windows and doors which might refers to the potential danger in reality.",There is a security warning sign beside a tree which is set by the office of community development in cooperation with the Oakland Police Department. And the sign looks like an eye that observing and supervising the neighborhoods.,"Many security signs are seen in front of the private residential houses telling people that the residents of those houses are under professional protection and security. We can find at least 3 security companies from the signs, such as ADT, Bay Alarm and Life Line, etc.","There is a sign read No Trespassing on the wall beside the side door. And thinking of all the signs mentioned above, the safety of this block is highly likely to be worrying.",2018-10-23 00:15:21,,4007.0
0,2.0,1.0,1.0,1.0,1.0,1.0,3.0,2.0,I thought it was interesting that in front of this house they had this little post. A little post that allowed people who passed by to take a book.,"This was one of the few, if only, houses that had random items scattered around the property.","This was one of the few houses, if only, that seemed to either be undergoing renovation or house with a damaged appearance.","This was a random house that I chose to represent the neighborhood. It was for the most part a well kept house, disregard the sideways cooler. ",,2018-10-24 00:17:21,,4201.0
1,1.0,2.0,2.0,2.0,2.0,2.0,1.0,3.0,The newly constructed and modern commercial buildings. Here we see a Starbucks Coffee and the Banfield Pet Hospital. ,"Here is a sign that says, ""Designated Free Speech Area"". In the corner, someone has tagged, ""I do what I want!"" I have never seen a sign like this before and wonder why the sign is there in the first place.","It was hard to find cigarette buds and empty liquor bottles, but I was able to find a couple further down Monroe Street.","Someone tagged 'Please Jesus"" on the outside of a warehouse storage bin. This is located in the parking lot of the recreational center.","Here is the empty basketball court with a little storage shack and skate ramp. In the 30 minutes that I was examining the block, no one stepped foot in the gated area. ",2018-10-22 22:19:38,"Community center, Eating places/restaurants, Fast food or take-out places, Parks, Playgrounds, Schools or daycare centers, Supermarkets/grocery stores, Warehouses",4204.0
0,1.0,1.0,1.0,1.0,1.0,1.0,3.0,3.0,"Albany High School. Its appearance looks a bit old, but it's well kept, and it has quite a lot of facilities, including a gymnasium, a swimming pool, and a baseball field. Looks like a descent high school. And right beside it, there's MacGregor High School, which is said to take care of student-at-risk from Albany High, though I am not sure what exactly their relation is.","The house is not big, without a front yard, and has only a limited backyard. But its appearance is clean and neat, appears to be well maintained. And it's a two-story house, while most on the street are one-story. One of the big houses on the street, though its outer design is quite plain compared with many others.","This is the north part of Memorial Park, where people bring their dogs to play. There were at least some twenty dogs running around on the grass when I passed by. The people seemed to know one another, and talked friendly. Interestingly, though, there were few kids in this part of the park.","Nothing special about this house. Well maintained, clean, one-story, quite common on this street. If anything, its appearance doesn't have any sort of decorations or particular designs that can make it stand out.","Probably one of the most beautiful house on the street. And it's large, and two-story, standing out at the end of the block very conspicuously, just like the white house on the other end of the block. Again, it's clean and well maintained. And judging from its appearance, its designer must have spent some efforts on it.",2018-10-23 22:59:20,"Parks, Schools or daycare centers",4201.0
0,1.0,1.0,2.0,1.0,1.0,2.0,3.0,2.0,"Well dress folks, lit trees, pristine sidewalk",Clean sidewalk,Bike lane sign and Starbucks sign,Very clean public parking lot,Starbucks and scooter,2018-10-23 01:11:34,"Bars and alcoholic beverage services, Eating places/restaurants",4031.0
1,3.0,2.0,3.0,1.0,1.0,4.0,3.0,3.0,"Shows some signage, and the bus stop",Shows some of the trash that littered the sidewalk,"A mural that was not graffitied, despite graffiti covering most of the surfaces surrounding it.",Reveals the unkempt aesthetics of the area,,2018-10-23 12:01:35,Professional offices (doctor dentist lawyer accountant real estate),4030.0
0,3.0,3.0,5.0,1.0,1.0,1.0,1.0,4.0,"Although rare, people are smoking on the street.",There are some nice street paintings here.,"People nearby rely on Laundromat, which means most units nearby does not have in-unit laundry.",,,2018-10-23 12:22:15,"Auto repair/auto body shop, Liquor stores or Marijuana Dispensaries",4033.0
0,1.0,1.0,1.0,1.0,1.0,1.0,3.0,2.0,This is one of the modern homes on the block. The front has a very modern and clean aesthetic and it is well kept. This home was the only house on this block with this type of style home. The rest of the homes on this block were also smaller and this home stood out to me. ,"This is an example of the apartment complexes on my block. The front area has vegetation and is maintained well with no garbage. The car in the front of the house is a Subaru, suggesting that these individuals can afford a good car.","This was the corner house on my residential block. There is no garbage or debris in the front of the house.  Also, the front lawn has roses, plants and a hose, suggesting that the occupants of this house take the time to garden. ",,,2018-10-23 13:57:52,,4205.0
